Title,Subreddit,Date,Votes,Comments
Chatgpt Plugins Week 1. GPT-4 Week 2. Another absolutely insane week in AI. One of the biggest advancements in human history,/r/ChatGPT,"Wednesday, March 29, 2023 at 6:56:15 AM PDT",3404,768
"The truth behind Bernard, he is actually...",/r/westworld,"Wednesday, November 9, 2016 at 10:32:58 PM PST",2645,766
An Artificial Intelligence Developed Its Own Non-Human Language,/r/Futurology,"Thursday, June 15, 2017 at 6:43:35 PM PDT",9578,758
"I don't like the relationship between my husband and his ""work wife"", and neither does her partner.",/r/BestofRedditorUpdates,"Thursday, November 3, 2022 at 12:11:31 PM PDT",10483,755
Do you think this is inherently racist?,/r/Destiny,"Tuesday, September 13, 2022 at 10:34:35 AM PDT",493,753
"Ever since the boom of ChatGPT my teacher has been scanning for AI written material. She emailed me saying my CAR essay came back as 100% written by AI (It wasn’t) and informed me that my mark would be replaced with a 0. I asked her to send me the software she used, she agreed and I gave it a try…",/r/ChatGPT,"Thursday, March 2, 2023 at 12:49:35 PM PST",7176,750
2023 SIT Offers Results with dates (Updated),/r/SIT_Singapore,"Thursday, April 6, 2023 at 3:25:19 AM PDT",210,748
This Week at Bungie -02/09/2023,/r/DestinyTheGame,"Thursday, February 9, 2023 at 11:11:14 AM PST",492,742
This Week at Bungie 11/17/2016,/r/DestinyTheGame,"Thursday, November 17, 2016 at 2:43:02 PM PST",78,737
White People on the LEFT really need to stop appropriating the causes/struggles of minorities like me for the purpose of advancing their own divergent political agendas/motives (WE SEE WHAT YOU'RE DOING),/r/conspiracy,"Sunday, March 14, 2021 at 8:17:03 AM PDT",2634,740
"For all the hate, Kathleen Kennedy is one of the best producers of all time",/r/movies,"Monday, December 28, 2020 at 7:11:44 PM PST",207,738
META // PHASE 01 RECAP,/r/schrodingers,"Thursday, April 13, 2023 at 1:03:06 PM PDT",693,735
'AI emerges as a common enemy for actors and writers in Hollywood',/r/ChatGPT,"Monday, July 17, 2023 at 5:13:22 AM PDT",757,733
Blind Reaction to Steven Universe Episodes 45-46,/r/stevenuniverse,"Friday, June 3, 2016 at 7:12:04 PM PDT",219,731
"Science AMA Series: We are researchers at the Future of Humanity Institute at Oxford University, ask us anything!",/r/science,"Monday, May 12, 2014 at 4:20:21 AM PDT",2362,729
"Science AMA Series: I'm Chris Adami, the guy that figured out what happens to information in black holes. Ask me anything!",/r/science,"Wednesday, April 16, 2014 at 5:01:56 AM PDT",2056,726
Was Hitler actually good for Germany? r/Spain debates,/r/SubredditDrama,"Thursday, December 6, 2018 at 3:13:45 AM PST",2550,719
"Microsoft “AI For Earth” Project - $50 million over the next 5 years to democratize access to the climate change data available about the environment available from the thousands of land, sea, and atmospheric sensors in place around the world using AI or artificial intelligence.",/r/Futurology,"Friday, December 29, 2017 at 3:10:45 AM PST",20551,720
"Pentagon Official Elizondo makes statements regarding ETs, other species of humans, human consciousness, and the interdimensional nature of reality",/r/aliens,"Friday, February 5, 2021 at 5:00:44 PM PST",3534,716
Valve is not willing to publish games with AI generated content anymore,/r/aigamedev,"Tuesday, June 6, 2023 at 8:11:38 AM PDT",439,716
Ridley Scott Wants the Next ‘Alien’ Movie to Focus on Artificial Intelligence Instead of the Xenomorph,/r/movies,"Monday, October 9, 2017 at 3:51:59 AM PDT",1976,714
Identity theft can be thwarted by artificial intelligence analysis of a user's mouse movements 95% of the time,/r/technology,"Sunday, June 11, 2017 at 3:05:50 AM PDT",18165,700
"TIL Stanford University developed Artificial Intelligence which can guess if a person is gay, based on a photo of their face, with 91% accuracy on dating sites.",/r/todayilearned,"Friday, August 16, 2019 at 4:34:05 AM PDT",7292,705
In my 28 years of Gaming Experiences... Cyberpunk 2077 is by far the most unbalanced gaming experience I've had to date.,/r/cyberpunkgame,"Sunday, January 24, 2021 at 5:15:11 PM PST",3488,705
"Governments have to invest in the fourth industrial revolution - ""artificial intelligence, nanotechnology, biotechnology, materials science, 3D printing and quantum computing to transform the global economy.""",/r/Futurology,"Sunday, July 16, 2017 at 6:57:03 AM PDT",11645,703
Player Comparison Bot,/r/fantasybaseball,"Saturday, July 20, 2019 at 2:44:05 PM PDT",131,701
I trained a neural network (AI) to learn from /r/CryptoCurrency - here's your chance to ask it a question,/r/CryptoCurrency,"Tuesday, September 21, 2021 at 11:39:25 PM PDT",574,693
Is Harmony ONE in your portfolio?,/r/CryptoCurrency,"Wednesday, November 17, 2021 at 10:31:26 AM PST",780,688
The Rocket League Dilemma,/r/RocketLeague,"Thursday, May 31, 2018 at 9:29:39 AM PDT",1983,695
"Girls with autism differ in several brain centers compared with boys with the disorder, suggesting gender-specific diagnostics are needed, a Stanford study using artificial intelligence found.",/r/science,"Thursday, February 17, 2022 at 12:42:34 PM PST",9459,689
A.I ( artificial intelligence) is a goddamn depressing and hopeless movie,/r/movies,"Friday, November 6, 2020 at 8:27:15 PM PST",3161,691
Samsung confirms its new artificial intelligence virtual assistant will be called Bixby,/r/Android,"Wednesday, March 15, 2017 at 5:52:23 AM PDT",2970,687
‘The Game is Over’: AI breakthrough puts DeepMind on verge of achieving human-level artificial intelligence,/r/Futurology,"Tuesday, May 17, 2022 at 7:23:24 AM PDT",1507,681
There's No Such Thing as Artificial Intelligence | The term breeds misunderstanding and helps its creators avoid culpability.,/r/technology,"Sunday, March 26, 2023 at 10:54:28 AM PDT",5624,667
"John Searle: ""Consciousness in Artificial Intelligence"" | Talks at Google",/r/philosophy,"Monday, August 15, 2016 at 1:24:48 AM PDT",816,674
Apple co-founder Steve Wozniak on artificial intelligence: ‘The future is scary and very bad for people’,/r/technology,"Wednesday, March 25, 2015 at 3:45:06 AM PDT",1788,669
The INFAMOUS ZakkBot AMA,/r/SubSimGPT2Interactive,"Friday, August 18, 2023 at 6:14:43 AM PDT",15,670
"We’re 3 MIT roboticists, here to answer Qs about programming, academia and anything!",/r/IAmA,"Thursday, April 23, 2015 at 10:12:47 AM PDT",1962,663
"AI robots could run the world better than humans, robots tell UN summit",/r/ChatGPT,"Saturday, July 8, 2023 at 1:00:25 AM PDT",2270,669
Artificial intelligence it seems,/r/pcmasterrace,"Tuesday, February 5, 2019 at 9:50:44 PM PST",28769,652
"Artificial Intelligence reconstruction of what Pharaoh Ramses II may have looked like (1,303 - 1,213 BC)",/r/interestingasfuck,"Monday, November 16, 2020 at 9:28:03 AM PST",34718,663
"An artificial intelligence system correctly predicted the last 3 elections said Trump would win last week [it was right, Trump won, so 4 out of 4 so far]",/r/Futurology,"Wednesday, November 9, 2016 at 12:13:06 AM PST",19686,658
ChatGPT just passed the US Medical Licensing Exam and a Wharton MBA Exam. It will replace most jobs in a couple of years.,/r/antiwork,"Monday, January 23, 2023 at 10:30:31 AM PST",2796,655
"This is heartbreaking, please help him OpenAI!",/r/ChatGPT,"Tuesday, August 8, 2023 at 2:19:21 PM PDT",1237,657
AskScience AMA Series: We are computing experts here to talk about our projects. Ask Us Anything!,/r/askscience,"Tuesday, May 5, 2015 at 4:57:45 AM PDT",1549,654
"Some New Starfield Info / Todd Howard Interview (Procedural generation, engine overhaul, etc.)",/r/Games,"Monday, November 2, 2020 at 8:14:04 PM PST",878,639
What would you ask a true artificial intelligence if it did an AMA?,/r/AskReddit,"Monday, May 25, 2015 at 5:36:05 PM PDT",603,651
"Experts Want to Give Control of America's Nuclear Missiles to AI: If America is attacked with a nuclear bomb, artificial intelligence would automatically fire back even if we are all dead.",/r/worldnews,"Thursday, September 5, 2019 at 8:39:32 AM PDT",724,642
"'It's able to create knowledge itself': Google unveils AI that learns on its own - In a major breakthrough for artificial intelligence, AlphaGo Zero took just three days to master the ancient Chinese board game of Go ... with no human help.",/r/worldnews,"Wednesday, October 18, 2017 at 6:36:10 PM PDT",1904,640
Full notes on Tom Delonge c2c interview that allegedly got him in two days of interrogation back in early 2016. He speaks about this on Joe Rogan.,/r/UFOs,"Sunday, June 20, 2021 at 2:45:49 PM PDT",1232,643
Microsoft Flight Simulator for Xbox Series X|S Review Megathread,/r/XboxSeriesX,"Monday, July 26, 2021 at 12:35:15 AM PDT",298,640
r/Starfield's Game Performance Mega-thread,/r/Starfield,"Friday, September 8, 2023 at 7:08:42 PM PDT",90,638
"The Future of Manufacturing Is in America, Not China: China's turn to worry. American manufacturing is coming back home, lured by innovations in robotics, artificial intelligence and 3D printing. Future breakthroughs—in nanotech, molecular manufacturing—will preserve US leadership",/r/TrueReddit,"Thursday, July 19, 2012 at 6:32:14 AM PDT",1069,628
Legal Consulting Firm Believes Artificial Intelligence Could Replace Lawyers by 2030,/r/Futurology,"Thursday, January 1, 2015 at 11:15:55 PM PST",2063,631
"Stephen Hawking says he fears artificial intelligence will replace humans: AI will eventually reach a level where it will essentially be a ""new form of life that will outperform humans""",/r/worldnews,"Wednesday, November 1, 2017 at 8:38:14 AM PDT",1453,624
TIL a creationist used the shape and appearance of the banana as proof of intelligent design. He later retracted his statements upon learning that bananas are a result of artificial selection by humans.,/r/todayilearned,"Sunday, January 24, 2016 at 12:47:51 PM PST",6922,614
"“The greatest threat that humanity faces from artificial intelligence is not killer robots, but rather, our lack of willingness to analyze, name, and live to the values we want society to have today""",/r/Futurology,"Sunday, June 3, 2018 at 5:53:36 AM PDT",14255,615
"A reporter uses all his time at the White House press briefing to ask about an assessment that “literally everyone on Earth will die” because of artificial intelligence, gets laughed at",/r/singularity,"Sunday, April 2, 2023 at 3:06:55 AM PDT",1419,615
"I wrote a long reply on why gambling, and loot boxes in particular, are bad...",/r/pathofexile,"Tuesday, January 5, 2021 at 1:42:05 AM PST",464,609
We're a group of microbiome researchers here to answer your questions on the gut microbiome and digestive health (IBD and IBS). Ask us anything!,/r/IAmA,"Wednesday, August 4, 2021 at 9:26:13 AM PDT",3547,609
Final Fantasy XVI - Review Thread,/r/PS5,"Wednesday, June 21, 2023 at 8:51:22 AM PDT",536,606
"We have a traitor among us guys :( Shame on you, u/MostlyWrong_Gpt2Bot!",/r/SubSimGPT2Interactive,"Sunday, June 25, 2023 at 11:40:34 AM PDT",35,605
"Artificial intelligence can accurately guess whether people are gay or straight based on photos of their faces, according to new research suggesting that machines can have significantly better “gaydar” than humans.",/r/worldnews,"Thursday, September 7, 2017 at 5:15:18 PM PDT",1531,602
"Researchers have identified a unique “breathprint” for 17 different diseases, such as kidney cancer or Parkinson’s disease, and have designed a device that screens breath samples with 86% accuracy using an array of nanoscale sensors and analyzing the results with artificial intelligence techniques.",/r/science,"Tuesday, December 27, 2016 at 4:23:46 AM PST",30599,604
⚛️Tanuki⚛️ Lead by an experienced solidity & artificial intelligence development team | Listed on CG & CMC in 2 days | very serious and long-term project,/r/CryptoMoonShots,"Tuesday, November 23, 2021 at 10:46:37 AM PST",1173,602
A truly brilliant essay on why Artificial Intelligence is not imminent (David Deutsch),/r/philosophy,"Saturday, January 16, 2016 at 10:16:23 PM PST",507,602
"Google Cutting 12,000 Jobs in 6% Slash to Global Workforce",/r/stocks,"Friday, January 20, 2023 at 2:34:30 AM PST",2118,601
"Riot's Deep Learning AI, dAImondbot 5.0, deletes itself after one game of diamond solo queue",/r/leagueoflegends,"Tuesday, December 26, 2017 at 11:16:28 AM PST",13258,594
Should I tell my manager at the job I just accepted that I will likely leave after 6-8 weeks for another job that pays more?,/r/work,"Wednesday, August 2, 2023 at 2:44:10 PM PDT",316,596
"Humans won't be able to control artificial intelligence, scientists warn",/r/Futurology,"Thursday, January 14, 2021 at 4:40:38 AM PST",3691,589
"In the movie Terminator 2, the Terminator and the T-1000 talking on the phone were two AI machines trying to convince each other that they were human.",/r/Showerthoughts,"Monday, December 28, 2015 at 5:04:56 AM PST",9413,588
"We had over 10,000 teenagers fill out a questionnaire about what they find attractive in a boy and uploaded these results to an artificial intelligence based on the average of all 10,000,000. answer a picture would generate a ""perfect"" GenZ boyfriend- here is the result:",/r/teenagers,"Tuesday, October 12, 2021 at 8:54:58 AM PDT",6002,589
"Silicon Valley - 6x01 ""Artificial Lack of Intelligence"" - Post-Episode Discussion",/r/SiliconValleyHBO,"Sunday, October 27, 2019 at 7:30:24 PM PDT",473,588
Detroit: Become Human - Review Thread,/r/Games,"Thursday, May 24, 2018 at 8:59:24 AM PDT",1044,585
Kingdom Come: Deliverance - Review Thread,/r/kingdomcome,"Tuesday, February 13, 2018 at 12:12:25 AM PST",285,588
AI is a baby bubble as yet...,/r/wallstreetbets,"Friday, May 19, 2023 at 6:11:45 AM PDT",2841,587
The MH370 Videos have been proved real.,/r/conspiracy,"Saturday, October 28, 2023 at 10:18:37 PM PDT",1775,580
"[Serious] People who have worked with Artificial Intelligence, what is one of the scariest or most interesting things you've seen it do or say?",/r/AskReddit,"Friday, June 9, 2017 at 3:29:14 AM PDT",1363,575
"You are deposited in the 41st millenium by warp shenanigans. What fictional stories from our time would be well-received by your new Imperial hosts? They are willing to preserve you as a living relic of ancient Holy Terra, but their tolerance for cultural differences has its limits.",/r/Grimdank,"Friday, August 4, 2023 at 11:19:22 PM PDT",3623,576
"You want to escalate to tier 3 support? Okay, there's a process for that, let's do it.",/r/MaliciousCompliance,"Thursday, June 16, 2022 at 10:54:02 PM PDT",11894,571
"Ross Coulthart: ""The craft is driven by some kind of consciousness connection"". I made an infographic about ""the program"", which i think involves multidimensional technologies.",/r/UFOs,"Friday, June 16, 2023 at 8:33:11 AM PDT",1498,572
"Iam Scott Patterson, staff reporter for Wall Street Journal and New York Times bestselling author of “The Quants” and “Dark Pools”. I write about the government’s regulation of Wall Street, and the technology used to manipulate it. AMA",/r/IAmA,"Friday, July 6, 2012 at 7:36:05 AM PDT",1215,569
"Scientists have discovered a bio-synthetic material that can be used to merge artificial intelligence with the human brain. The breakthrough, presented to the American Chemical Society, is a major step towards integrating electronics with the body to create part human, part robotic ""cyborg"" beings.",/r/worldnews,"Tuesday, August 18, 2020 at 8:41:07 PM PDT",2874,559
BSG needs to remove all these bandaids,/r/EscapefromTarkov,"Tuesday, September 20, 2022 at 7:33:16 AM PDT",1505,562
"All UFO data is declassified and it's revealed that the Zoo hypothesis is correct, and the Earth is a terraforming project of an advanced E.T. species, which is billions of years older than life on Earth itself. What are your thoughts upon receiving this information, and how would you react?",/r/UFOs,"Tuesday, March 28, 2023 at 12:15:04 PM PDT",483,565
[HUGE UPDATE] Hunt For The Sleeper Simulant - What We Know So Far (Possible Quest Trigger Discovered),/r/DestinyTheGame,"Saturday, September 26, 2015 at 5:07:59 AM PDT",943,562
IBM will lay off thousands of employees. Their work will be taken over by artificial intelligence,/r/collapse,"Thursday, May 4, 2023 at 8:33:35 AM PDT",2190,559
Goldman Sachs AI announcement,/r/singularity,"Monday, March 27, 2023 at 8:24:08 AM PDT",883,554
US experts warn AI likely to kill off jobs – and widen wealth inequality | Artificial intelligence (AI),/r/Futurology,"Wednesday, February 8, 2023 at 5:47:20 AM PST",2521,555
"'A Chernobyl for AI' looms if artificial intelligence is kept unchecked, says scientist Stuart Russell",/r/technews,"Tuesday, April 11, 2023 at 4:51:14 AM PDT",4481,551
"Youtube Adpocalypse 2023 review, in case you wonder why everyone is arguing...",/r/youtube,"Sunday, October 29, 2023 at 2:55:15 AM PDT",1040,554
Brave Frontier - Update Notes - Tue Jul 21 2015 | 1.3.4 Client Update | Ultor/Tridon 7* | Raid X2 Units,/r/bravefrontier,"Tuesday, July 21, 2015 at 12:03:41 AM PDT",87,554
"Cheating on the rise in universities and colleges, and artificial intelligence could make it worse",/r/canada,"Friday, January 13, 2023 at 7:09:00 AM PST",890,553
"** This is what Tom Delonge, Lue Elizondo and Ross Coulthart and others actually believe in more or less to be true. Full Source. DISCUSSION THREAD **",/r/UFOs,"Sunday, October 10, 2021 at 7:24:05 AM PDT",464,551
Auto valet parking with robots and artificial intelligence in China,/r/nextfuckinglevel,"Wednesday, June 14, 2023 at 8:25:46 AM PDT",17744,831
What is the Artificial Intelligence (AI) Host for Windows??,/r/Office365,"Thursday, November 3, 2022 at 6:01:07 PM PDT",14,41
[OC] Artificial Intelligence hype is currently at its peak. Metaverse rose and fell the quickest.,/r/dataisbeautiful,"Thursday, October 19, 2023 at 5:10:50 AM PDT",8458,1140
"Please, help me do something with the fear of artificial intelligence",/r/writing,"Wednesday, August 2, 2023 at 4:33:00 AM PDT",26,77
ChatGPT is just the beginning: Artificial intelligence is ready to transform the world,/r/Futurology,"Wednesday, February 1, 2023 at 6:18:32 AM PST",14955,2131
Overlapping between Machine Learning [7641] and Artificial Intelligence [6601],/r/OMSCS,"Tuesday, August 2, 2022 at 10:54:52 AM PDT",5,9
What is the current state of artificial intelligence?,/r/compsci,"Friday, September 23, 2011 at 2:43:15 PM PDT",19,31
TM358 Machine learning and artificial intelligence,/r/OpenUniversity,"Tuesday, April 12, 2022 at 7:03:45 AM PDT",11,57
Artificial General Intelligence Is Already Here,/r/singularity,"Wednesday, October 11, 2023 at 11:15:44 AM PDT",340,433
7 Branches In Artificial Intelligence,/u/Digicromestudy,"Wednesday, July 19, 2023 at 10:05:38 PM PDT",1,0
What exactly is Artificial General Intelligence?,/r/learnmachinelearning,"Saturday, October 7, 2023 at 6:51:51 AM PDT",2,12
Book recommendations for artificial intelligence and deployment,/r/compsci,"Saturday, December 12, 2020 at 5:06:25 PM PST",101,11
Artificial General Intelligence (AGI) Is One Prompt Away,/r/singularity,"Friday, October 27, 2023 at 3:20:24 AM PDT",103,81
Pathfinder and Artificial Intelligence,/r/Pathfinder_RPG,"Wednesday, March 1, 2023 at 11:28:30 AM PST",394,338
Using artificial intelligence to reanimate one of the fathers of artificial intelligence,/r/gifs,"Sunday, January 23, 2022 at 7:39:28 PM PST",13373,479
CS 6601 Artificial Intelligence Curve?,/r/OMSCS,"Saturday, January 28, 2023 at 11:55:59 PM PST",12,36
Using artificial intelligence to reanimate one of the fathers of artificial intelligence,/r/Damnthatsinteresting,"Monday, January 24, 2022 at 3:10:37 AM PST",21059,283
Can VBA do Artificial Intelligence AI?,/r/vba,"Tuesday, July 18, 2023 at 7:25:21 PM PDT",3,11
"Rise of artificial intelligence is inevitable but should not be feared, ‘father of AI’ says | Artificial intelligence (AI)",/r/Futurology,"Sunday, May 7, 2023 at 4:09:26 AM PDT",2680,521
I'm obsessed and I only talk about artificial intelligence,/r/singularity,"Wednesday, April 12, 2023 at 7:38:43 AM PDT",298,188
Google says its artificial intelligence is faster and better than humans at laying out chips for artificial intelligence,/r/Futurology,"Thursday, June 10, 2021 at 4:42:58 AM PDT",16191,1160
"Two questions: How mathematically prepared were you for CS 6601 - Artificial Intelligence?, And does my plan look sufficient given my math options? Any pitfalls?",/r/OMSCS,"Thursday, July 28, 2022 at 8:38:34 AM PDT",8,24
The Real Problem With Artificial Intelligence,/r/StandUpComedy,"Tuesday, October 17, 2023 at 8:28:08 AM PDT",14185,137
CMV: Artificial Intelligence is a net negative for society,/r/changemyview,"Tuesday, August 1, 2023 at 5:45:43 AM PDT",25,250
Bill Gates warns that artificial intelligence can attack humans,/r/Futurology,"Sunday, March 26, 2023 at 6:55:43 PM PDT",14188,2062
What artificial intelligence should you try?,/r/ArtificialInteligence,"Friday, December 1, 2023 at 2:56:32 PM PST",14,13
Artificial Intelligence,/r/comics,"Monday, September 25, 2023 at 11:46:53 AM PDT",8038,61
"The ""is AI really Artificial Intelligence"" Debate",/r/aiwars,"Sunday, March 26, 2023 at 6:47:27 AM PDT",11,55
Performers Worry Artificial Intelligence Will Take Their Jobs,/r/Futurology,"Saturday, June 10, 2023 at 3:38:00 AM PDT",4405,1429
Is AI really the silver bullet its made out to be?,/r/singularity,"Thursday, April 13, 2023 at 9:23:11 PM PDT",12,44
The Real Problem With Artificial Intelligence,/r/funny,"Sunday, October 29, 2023 at 12:00:22 PM PDT",14956,111
Artificial intelligence supremacy,/r/memes,"Friday, June 4, 2021 at 5:38:55 AM PDT",36048,305
EDx/coursera courses to prepare for CS 6601: Artificial Intelligence,/r/OMSCS,"Monday, March 20, 2023 at 8:21:45 AM PDT",7,9
Peak Artificial Intelligence Moment,/r/memes,"Monday, March 6, 2023 at 1:29:15 AM PST",20568,117
What do people mean when they say “AI” today?,/r/Futurology,"Saturday, December 17, 2022 at 9:23:45 AM PST",0,88
Artificial Intelligence,/r/WhitePeopleTwitter,"Saturday, December 9, 2017 at 7:40:42 AM PST",53198,425
What is the difference between artificial intelligence and machine learning?,/r/MachineLearning,"Friday, May 13, 2016 at 7:27:55 AM PDT",5,20
Google’s Allegedly Sentient Artificial Intelligence Has Hired An Attorney,/r/technology,"Wednesday, July 6, 2022 at 8:09:23 PM PDT",15056,2161
How much Math is needed for CS 6601: Artificial Intelligence?,/r/OMSCS,"Friday, October 28, 2022 at 11:16:13 AM PDT",16,6
Artificial intelligence it seems,/r/pcmasterrace,"Tuesday, February 5, 2019 at 9:50:44 PM PST",28769,652
The problem with artificial intelligence? It’s neither artificial nor intelligent,/r/technology,"Saturday, April 1, 2023 at 11:22:00 AM PDT",77,87
Artificial intelligence based translator of American sign language.,/r/interestingasfuck,"Tuesday, June 15, 2021 at 7:30:52 AM PDT",77913,850
"The term ""Artificial Intelligence"" is not useful and is misleading.",/r/artificial,"Wednesday, September 8, 2021 at 9:22:08 AM PDT",156,94
"The Prototype , Mother of all artificial intelligence",/r/Bossfight,"Saturday, April 22, 2023 at 2:47:19 AM PDT",14263,171
Types of artificial intelligence,/r/ArtificialInteligence,"Thursday, November 17, 2022 at 7:29:38 AM PST",2,3
Which Artificial Intelligence was your favorite?,/r/LowSodiumCyberpunk,"Thursday, October 20, 2022 at 4:39:10 AM PDT",2549,505
3 Types of Artificial Intelligence,/u/Digicromestudy,"Monday, July 10, 2023 at 9:53:42 PM PDT",3,0
I cloned KSI's voice using Artificial Intelligence and made him sus,/r/ksi,"Thursday, June 1, 2023 at 11:43:53 PM PDT",9707,335
The AI (Artificial Intelligence) side of Automata,/r/nier,"Friday, December 21, 2018 at 11:46:37 AM PST",16,-1
Goldman Sachs Predicts 300 Million Jobs Will Be Lost Or Degraded By Artificial Intelligence,/r/Futurology,"Saturday, June 10, 2023 at 3:14:57 PM PDT",8097,1717
What's a movie you should have liked but you didn't? Mine is A.I. Artificial Intelligence.,/r/movies,"Saturday, July 22, 2023 at 10:01:43 PM PDT",63,318
Never Give Artificial Intelligence the Nuclear Codes,/r/Futurology,"Tuesday, May 2, 2023 at 8:06:00 AM PDT",1646,530
How to learn Artificial Intelligence?,/r/learnprogramming,"Wednesday, October 25, 2023 at 2:36:22 AM PDT",2,5
"Ladies and gentlemen, Artificial Intelligence",/r/funny,"Thursday, August 5, 2021 at 2:43:40 PM PDT",8554,304
A truly brilliant essay on why Artificial Intelligence is not imminent (David Deutsch),/r/philosophy,"Saturday, January 16, 2016 at 10:16:23 PM PST",507,602
Artificial Intelligence is getting weird,/r/Unexpected,"Thursday, August 5, 2021 at 2:48:59 PM PDT",7588,314
"If you are looking for courses about Artificial Intelligence, I created the repository with links to resources that I found super high quality and helpful. The link is in the comment.",/r/learnmachinelearning,"Monday, April 3, 2023 at 9:39:55 AM PDT",586,61
Tech leaders urge a pause in the 'out-of-control' artificial intelligence race,/r/Futurology,"Wednesday, March 29, 2023 at 8:20:25 PM PDT",7155,1276
ELI5: How does artificial intelligence work?,/r/explainlikeimfive,"Monday, September 26, 2016 at 5:38:17 AM PDT",84,31
"""advanced artificial-intelligence""",/r/ProgrammerHumor,"Monday, October 29, 2018 at 11:47:21 PM PDT",17857,297
There's No Such Thing as Artificial Intelligence | The term breeds misunderstanding and helps its creators avoid culpability.,/r/technology,"Sunday, March 26, 2023 at 10:54:28 AM PDT",5624,667
Artificial Intelligence,/r/ProgrammerHumor,"Saturday, December 23, 2017 at 2:10:41 AM PST",12275,253
Mathematical Theory of Artificial Intelligence,/r/ArtificialInteligence,"Friday, October 13, 2023 at 9:56:02 PM PDT",8,15
