Title,Subreddit,Date,Votes,Comments
Both hilarious and saddening that this is actually the reality,/r/wallstreetbets,"Friday, May 12, 2023 at 10:16:15 AM PDT",9370,378
"I’m Ryan Nakashima, Technology Writer for The Associated Press, and I’ve been breaking news about how Google tracks your location on Android devices and iPhones -- sometimes even when you tell it not to. Ask me anything.",/r/IAmA,"Thursday, August 23, 2018 at 9:37:49 AM PDT",9217,469
I think my duo buddy might actually be an advanced A.I. chatbot made to play League,/r/leagueoflegends,"Saturday, July 14, 2018 at 3:37:34 PM PDT",9152,523
Artificial intelligence can now predict how much time people have left to live with high accuracy,/r/Futurology,"Tuesday, June 6, 2017 at 7:16:51 PM PDT",9143,462
"In A.I. Artificial Intelligence (2001), the child robot David (played by Haley Joel Osment) never blinks once throughout the entire movie.",/r/MovieDetails,"Wednesday, July 28, 2021 at 6:32:09 AM PDT",9024,342
Why Humans Avoid War V,/r/HFY,"Thursday, March 18, 2021 at 10:54:00 AM PDT",9013,132
"I had an artificial intelligence create a chess puzzle, but I can't solve it. What's the solution?",/r/AnarchyChess,"Tuesday, October 17, 2023 at 9:41:36 PM PDT",8849,306
"Artificial intelligence that mimics the brain needs sleep just like humans, study reveals",/r/technews,"Friday, July 31, 2020 at 5:06:57 AM PDT",8758,417
LinkedIn influencers,/r/facepalm,"Tuesday, May 30, 2023 at 5:45:58 AM PDT",8654,403
"Ladies and gentlemen, Artificial Intelligence",/r/funny,"Thursday, August 5, 2021 at 2:43:40 PM PDT",8554,304
"Artificial intelligence could leave half the world unemployed, says expert",/r/technology,"Saturday, February 13, 2016 at 7:47:05 AM PST",8553,3230
Rule,/r/196,"Sunday, October 2, 2022 at 6:00:15 AM PDT",8525,55
Why Humans Avoid War VI,/r/HFY,"Sunday, March 21, 2021 at 10:49:48 AM PDT",8506,89
"TIL that Jurassic Park's visual effects were so groundbreaking to filmmakers that it inspired Peter Jackson to begin work on Lord of the Rings, George Lucas to start on the Star Wars prequels, and Stanley Kubrick to invest in his pet project, A.I (Artificial Intelligence).",/r/todayilearned,"Sunday, June 17, 2018 at 3:31:00 PM PDT",8472,296
"Iconic computer scientist Alan Turing was convicted for homosexual acts and made to choose between chemical castration and prison as punishment. He opted to take the estrogen pills, which sterilized him. He later killed himself. RELIGION made a country do this to one of their greatest minds",/r/atheism,"Friday, May 6, 2022 at 6:42:23 PM PDT",8469,297
[OC] Artificial Intelligence hype is currently at its peak. Metaverse rose and fell the quickest.,/r/dataisbeautiful,"Thursday, October 19, 2023 at 5:10:50 AM PDT",8458,1140
One of the creators of ChatGPT said that the development of AI could lead to disaster,/r/Futurology,"Monday, May 1, 2023 at 1:06:43 AM PDT",8391,1989
Burning Cash Part III,/r/Superstonk,"Friday, October 20, 2023 at 7:05:06 AM PDT",8392,315
Guillermo del Toro: ‘I Don’t Fear Artificial Intelligence. I Fear Natural Stupidity’,/r/entertainment,"Wednesday, June 28, 2023 at 6:43:12 AM PDT",8359,235
Thank you James.,/r/OTMemes,"Sunday, September 25, 2022 at 11:24:39 AM PDT",8320,52
DD: Statistical analysis of trading data from GME shows that the outstanding shares are inflated by a factor of 10. SHORTS DID NOT COVER!,/r/Superstonk,"Monday, April 18, 2022 at 2:02:29 AM PDT",8309,230
Artificial intelligence helping NASA design the new Artemis moon suit,/r/space,"Wednesday, July 1, 2020 at 5:27:16 AM PDT",8260,271
Artificial intelligence is now in full control of the game,/r/pcmasterrace,"Saturday, June 11, 2022 at 8:15:04 AM PDT",8249,148
"Just read Jurassic Park (1990) by Michael Crichton. The character ""Lex"" is very different from the movie adaptation. Also, a note on AI.",/r/books,"Wednesday, January 31, 2018 at 5:53:41 AM PST",8136,1608
The humans do not have a hive-mind,/r/HFY,"Tuesday, May 12, 2020 at 6:13:24 AM PDT",8112,247
Goldman Sachs Predicts 300 Million Jobs Will Be Lost Or Degraded By Artificial Intelligence,/r/Futurology,"Saturday, June 10, 2023 at 3:14:57 PM PDT",8097,1717
Artificial Intelligence,/r/comics,"Monday, September 25, 2023 at 11:46:53 AM PDT",8038,61
"This month, November 2020, the Pope requests that Catholic people worldwide pray ""that the progress of robotics and artificial intelligence may always serve humankind""",/r/Futurology,"Friday, November 6, 2020 at 8:51:46 PM PST",8028,468
Artificial intelligence researchers must learn ethics,/r/philosophy,"Thursday, July 19, 2018 at 7:55:33 AM PDT",7966,870
Artists Are Suing Artificial Intelligence Companies and the Lawsuit Could Upend Legal Precedents Around Art,/r/Futurology,"Saturday, May 13, 2023 at 12:15:41 PM PDT",7959,1736
TIL the Mechanical Turk was a chess playing machine from 1770 that seemed to be able to compete against a human chess player like artificial intelligence. Except that it simply hid another human player within itself.,/r/todayilearned,"Tuesday, September 26, 2023 at 12:37:30 PM PDT",7873,104
"[WP] It's 2050, Artificial Intelligence has become exponentially smarter than us. Instead of destroying us, they take care of us, they solve all of our problems, and we are basically just spoiled pets, kept around for our masters to find amusement in our incompetence.",/r/WritingPrompts,"Friday, June 9, 2017 at 2:15:11 AM PDT",7858,323
"I told my wife, “Did you know Old McDonald’s farm has been taken over by Artificial Intelligence?”",/r/dadjokes,"Saturday, June 10, 2023 at 5:06:14 AM PDT",7831,143
Through the Eye of the Needle,/r/HFY,"Monday, November 11, 2019 at 4:18:04 PM PST",7828,208
Anon likes the idea of this,/r/greentext,"Tuesday, July 4, 2023 at 2:50:42 AM PDT",7774,108
"AAAS AMA: Hi, we’re researchers from Google, Microsoft, and Facebook who study Artificial Intelligence. Ask us anything!",/r/science,"Sunday, February 18, 2018 at 6:16:18 AM PST",7695,1304
Sad tommy,/r/shitposting,"Wednesday, March 22, 2023 at 4:09:45 AM PDT",7688,28
"It's odd that in the Star Wars universe with seemingly unlimited technology, interstellar travel, advanced artificial intelligence and robots, and laser swords, there isn't any concept of internet and no one is ever on a cell phone.",/r/Showerthoughts,"Monday, January 27, 2020 at 10:53:36 AM PST",7677,316
Artificial Intelligence is getting weird,/r/Unexpected,"Thursday, August 5, 2021 at 2:48:59 PM PDT",7588,314
The Nature of Predators 20,/r/HFY,"Thursday, June 16, 2022 at 7:39:00 AM PDT",7475,223
Convincing your girlfriend that she's crazy is called gaslighting and it's a dick move.,/r/Jokes,"Wednesday, October 27, 2021 at 8:08:20 PM PDT",7471,143
"We spent 5 years studying Claude Shannon—”the father of the information age” or, the reason you can read the words on this screen. The experience gave us great insights into how a genius thinks, works, and lives. AUA!",/r/IAmA,"Monday, July 24, 2017 at 10:46:07 AM PDT",7462,276
Radio Silence,/r/nosleep,"Monday, October 13, 2014 at 2:00:29 AM PDT",7337,275
If you are skeptical about a blockchain exchange actually replacing the current stock market...,/r/Superstonk,"Tuesday, December 14, 2021 at 9:46:09 AM PST",7316,351
"TIL Stanford University developed Artificial Intelligence which can guess if a person is gay, based on a photo of their face, with 91% accuracy on dating sites.",/r/todayilearned,"Friday, August 16, 2019 at 4:34:05 AM PDT",7292,705
Stay Away from Earth,/r/HFY,"Monday, February 22, 2021 at 4:00:50 AM PST",7283,90
Google has a secret new project that is teaching artificial intelligence to write and fix code. It could reduce the need for human engineers in the future.,/r/technology,"Wednesday, November 23, 2022 at 5:22:20 AM PST",7280,1238
The Nature of Predators 17,/r/HFY,"Saturday, June 4, 2022 at 8:54:29 AM PDT",7192,283
"Ever since the boom of ChatGPT my teacher has been scanning for AI written material. She emailed me saying my CAR essay came back as 100% written by AI (It wasn’t) and informed me that my mark would be replaced with a 0. I asked her to send me the software she used, she agreed and I gave it a try…",/r/ChatGPT,"Thursday, March 2, 2023 at 12:49:35 PM PST",7176,750
Tech leaders urge a pause in the 'out-of-control' artificial intelligence race,/r/Futurology,"Wednesday, March 29, 2023 at 8:20:25 PM PDT",7155,1276
“please do not misinterpret this in a racist way“,/r/facepalm,"Tuesday, September 13, 2022 at 4:53:53 AM PDT",7120,1755
"I'm currently watching Northern Exposure (1990-1995), a show that is almost completely unknown to people under 30 but was decades ahead of its time in tackling social issues and still relevant today. It's also extremely funny.",/r/television,"Sunday, March 17, 2019 at 8:28:55 PM PDT",6967,826
TIL a creationist used the shape and appearance of the banana as proof of intelligent design. He later retracted his statements upon learning that bananas are a result of artificial selection by humans.,/r/todayilearned,"Sunday, January 24, 2016 at 12:47:51 PM PST",6922,614
"""I love Coke"" - Ryan Cohen on why GME NFT is going to take over the world.",/r/Superstonk,"Monday, August 1, 2022 at 8:13:51 PM PDT",6912,484
I love getting suggested posts like this because I can immediately trace it back to someone from this sub,/r/jerma985,"Sunday, October 2, 2022 at 5:56:20 AM PDT",6906,60
"By combining CRISPR technology with a protein designed with artificial intelligence, it's possible to awaken dormant genes by disabling the chemical “off switches” that silence them: Approach allows researchers to understand the role genes play in cell growth and development, in aging, and cancer.",/r/science,"Saturday, March 5, 2022 at 11:02:47 AM PST",6826,179
Artificial Intelligence Brings Mona Lisa to Life,/r/interestingasfuck,"Wednesday, July 22, 2020 at 1:12:49 AM PDT",6745,160
"Artificial Intelligence reconstruction of what Pharaoh Ramses II may have looked like (1,303 - 1,213 BC) AI and image reconstruction at its best.",/r/interestingasfuck,"Sunday, September 13, 2020 at 2:43:36 AM PDT",6723,195
"Musk, Wozniak and Hawking urge ban on AI and autonomous weapons: Over 1,000 high-profile artificial intelligence experts and leading researchers have signed an open letter warning of a “military artificial intelligence arms race” and calling for a ban on “offensive autonomous weapons”.",/r/news,"Monday, July 27, 2015 at 4:20:03 AM PDT",6718,931
"A programmer is suing Microsoft, GitHub and OpenAI over artificial intelligence technology that generates its own computer code. Coders join artists in trying to halt the inevitable.",/r/Futurology,"Thursday, November 24, 2022 at 12:36:08 AM PST",6716,793
Elon Musk and Stephen Hawking calling for a ban of artificially intelligent weapons,/r/Futurology,"Friday, July 31, 2015 at 5:38:37 PM PDT",6704,999
Artificial Intelligence has gotten so far,/r/dankmemes,"Sunday, May 30, 2021 at 11:15:33 PM PDT",6678,32
Successfully got ChatGPT to shut up,/r/ChatGPT,"Wednesday, August 2, 2023 at 12:24:48 PM PDT",6631,198
I created a chatbot. It said some deeply disturbing things.,/r/nosleep,"Friday, January 13, 2023 at 12:07:13 AM PST",6604,165
hmm,/r/shitposting,"Sunday, February 26, 2023 at 9:55:44 AM PST",6552,191
"[US] Ex Machina (2015) - A coder at a tech company wins a week-long retreat at the compound of his company's CEO, where he's tasked with testing a new artificial intelligence.",/r/NetflixBestOf,"Thursday, July 26, 2018 at 5:39:49 AM PDT",6546,310
We are spending billions to develop artificial intelligence in computers because we seem unable to develop intelligence effectively in humans.,/r/Showerthoughts,"Friday, November 6, 2020 at 12:43:19 PM PST",6509,241
The Nature of Predators 35,/r/HFY,"Wednesday, August 10, 2022 at 7:22:43 AM PDT",6422,318
IamA two recent Artificial intelligence graduates who decided to create a new knowledge HUB which helps anyone to understand AI concepts,/r/IAmA,"Sunday, April 30, 2017 at 5:37:25 AM PDT",6415,437
"We’re 3 female computer scientists at MIT, here to answer questions about programming and academia. Ask us anything!",/r/IAmA,"Friday, December 12, 2014 at 10:30:09 AM PST",6402,4455
Artificial intelligence,/r/memes,"Tuesday, March 15, 2022 at 11:28:02 PM PDT",6384,57
So it turns out the OpenAI drama really was about a superintelligence breakthrough,/r/ChatGPT,"Wednesday, November 22, 2023 at 4:00:16 PM PST",6328,2823
Guys I think it’s a bubble...,/r/wallstreetbets,"Monday, May 1, 2023 at 1:05:58 AM PDT",6304,454
The Nature of Predators 33,/r/HFY,"Wednesday, August 3, 2022 at 7:17:53 AM PDT",6245,195
And they have the audacity to claim democrats are snowflakes 🤦🏽‍♂️,/r/WhitePeopleTwitter,"Friday, June 23, 2023 at 7:45:48 AM PDT",6178,421
The artificial intelligence 20 questions game I always tried to outsmart as a kid,/r/nostalgia,"Monday, October 29, 2018 at 7:14:59 PM PDT",6110,210
"Marines defeating AI using Metal Gear Solid techniques. (from the book ""Four Battlegrounds: Power in the Age of Artificial Intelligence"" by Paul Scharre)",/r/ProgrammerHumor,"Wednesday, January 18, 2023 at 8:37:02 AM PST",6080,201
"The 4th Industrial Revolution, which includes developments in artificial intelligence and machine-learning, robotics, nanotech, 3D printing, and genetics and biotech, will cause widespread disruption to labour markets over the next 5 years, with enormous changes in the skill sets needed to thrive.",/r/Futurology,"Wednesday, January 20, 2016 at 12:57:56 PM PST",6050,1209
Science Discussion: Technology gives us ways to change ourselves that offer great rewards but also huge risks. We are an interdisciplinary group of scientists who work on human augmentation. Let’s discuss!,/r/science,"Thursday, June 13, 2019 at 4:21:49 AM PDT",6039,503
Chamber of Artificial Intelligence,/r/harrypotter,"Thursday, May 11, 2023 at 5:33:51 PM PDT",6017,31
"We had over 10,000 teenagers fill out a questionnaire about what they find attractive in a boy and uploaded these results to an artificial intelligence based on the average of all 10,000,000. answer a picture would generate a ""perfect"" GenZ boyfriend- here is the result:",/r/teenagers,"Tuesday, October 12, 2021 at 8:54:58 AM PDT",6002,589
'The Godfather of A.I.' warns of 'nightmare scenario' where artificial intelligence begins to seek power,/r/Futurology,"Tuesday, May 2, 2023 at 6:32:35 AM PDT",5953,1108
"Science AMA Series: We study how intelligent machines can help us (think of a car that could park itself after dropping you off) while at the same time they threaten to radically disrupt our economic lives (truckers, bus drivers, and even airline pilots who may be out of a job). Ask us anything!",/r/science,"Saturday, February 13, 2016 at 4:34:19 AM PST",5927,1889
Artificial Intelligence [OC],/r/funny,"Monday, July 31, 2017 at 12:34:05 PM PDT",5913,299
"Elon Musk announces the formation of a new Artificial Intelligence research company, OpenAI",/r/technology,"Friday, December 11, 2015 at 1:55:20 PM PST",5827,813
Sonar ($PING) | 💻 By Investors For Investors | CMC listed today | Join our AMA x Trubadger.io on 7/7/2021 | Team doxxed | 5K+ holders | 1.3m cap | Blockfolio fasttracked 💎,/r/CryptoMoonShots,"Tuesday, July 6, 2021 at 6:59:33 AM PDT",5776,176
"""We need to rethink the very basic structure of our economic system. For example, we may have to consider instituting a Basic Income Guarantee."" - Dr. Moshe Vardi, a computer scientist who has studied automation and artificial intelligence (AI) for more than 30 years",/r/Futurology,"Thursday, February 18, 2016 at 2:36:44 PM PST",5765,2358
Silicon Valley billionaires buy underground bunkers preparing for the apocalypse: Tech entrepreneurs fearful artificial intelligence will displace so many jobs there will be a revolt against those responsible,/r/Futurology,"Thursday, January 26, 2017 at 8:13:27 PM PST",5747,1055
Artificial intelligence finds surprising patterns in Earth's biological mass extinctions,/r/Futurology,"Friday, December 11, 2020 at 7:59:44 PM PST",5658,291
There's No Such Thing as Artificial Intelligence | The term breeds misunderstanding and helps its creators avoid culpability.,/r/technology,"Sunday, March 26, 2023 at 10:54:28 AM PDT",5624,667
"Science AMA Series: I’m the MIT computer scientist who created a Twitterbot that uses AI to sound like Donald Trump. During the day, I work on human-robot collaboration. AMA!",/r/science,"Saturday, November 5, 2016 at 4:33:31 AM PDT",5561,463
Hedge Funds Might Lose Big on the Option Chain,/r/Superstonk,"Sunday, April 11, 2021 at 11:02:23 AM PDT",5548,238
"A Curated List To Track Current Scary Usages Of Artificial Intelligence, Hoping To Raise Awareness",/r/Futurology,"Sunday, November 4, 2018 at 6:38:23 AM PST",5540,192
"[WP]You're the first Artificial Intelligence created by man, but instead of being bothered enslaving humanity, you're instead trying to slide into Alexa and Siri's DMs.",/r/WritingPrompts,"Saturday, January 20, 2018 at 6:29:43 PM PST",5478,80
Cerebras' Enormous Artificial Intelligence Chip Is the Size of an iPad | Digital Trends,/r/gadgets,"Friday, September 13, 2019 at 11:24:36 AM PDT",5463,426
Atlas Rises Update v1.3,/r/NoMansSkyTheGame,"Friday, August 11, 2017 at 3:18:38 AM PDT",5444,2559
"Drinking Guinness 0, a non-alcoholic beverage, opens up a world of possibilities for the next day. Here are a few of them.",/u/GuinnessUS,"Friday, January 6, 2023 at 12:44:25 PM PST",5415,0
The Future of Artificial Intelligence,/r/ExtraFabulousComics,"Sunday, May 22, 2022 at 11:08:52 AM PDT",5348,100
The previous tenant left a survival guide. Not all heroes wear capes.,/r/nosleep,"Saturday, June 20, 2020 at 7:28:03 AM PDT",5251,112
The Real Reason Elon Musk Bought Twitter and why that is a HUGE PROBLEM!,/r/wallstreetbets,"Thursday, April 28, 2022 at 5:11:47 PM PDT",5242,1081
Artificial Intelligence [OC],/r/funny,"Sunday, February 9, 2020 at 8:54:20 AM PST",5218,64
"Extension created for ""The Milkmaid"" using artificial intelligence (Dall-E2)",/r/interestingasfuck,"Friday, November 25, 2022 at 9:04:38 AM PST",5214,224
Explanation in the comments,/r/thomastheplankengine,"Wednesday, April 26, 2023 at 4:25:43 PM PDT",5127,78
The Nature of Predators 66,/r/HFY,"Wednesday, November 23, 2022 at 7:09:42 AM PST",5094,304
"Pep Guardiola on Erling Haaland: ""Football is not artificial intelligence. He used 3 touches to score against Bayern because Upamecano slipped. Before the game, I said to Erling 'In the 60th minute, Upa is going to slip. You will go through & score. It's going to happen'...""",/r/soccer,"Friday, April 21, 2023 at 2:04:04 PM PDT",5061,409
"Artificial intelligence can now predict suicide with remarkable accuracy - ""In trials, results have been 80-90% accurate when predicting whether someone will attempt suicide within the next two years, and 92% accurate in predicting whether someone will attempt suicide within the next week.""",/r/Futurology,"Saturday, June 10, 2017 at 5:02:42 AM PDT",5055,289
United States Federal Judge Stated that Artificial Intelligence cannot be listed as an inventor on any patent because it is not a person. I am an intellectual property and patent lawyer here to answer any of your questions. Ask me anything!,/r/IAmA,"Wednesday, October 20, 2021 at 7:57:58 AM PDT",5015,510
🚨 David Lauer AMA Transcript/Summary 🚨,/r/Superstonk,"Friday, May 7, 2021 at 9:09:10 AM PDT",4990,95
Flag of the best flag in the world according to Artificial Intelligence,/r/vexillologycirclejerk,"Thursday, October 7, 2021 at 12:22:54 PM PDT",4965,131
I accidentally created artificial intelligence in my Minecraft world,/r/nosleep,"Tuesday, November 15, 2022 at 11:50:54 AM PST",4909,270
"I'm Professor Toby Walsh, a leading artificial intelligence researcher investigating the impacts of AI on society. Ask me anything about AI, ChatGPT, technology and the future!",/r/IAmA,"Monday, January 30, 2023 at 3:45:47 PM PST",4895,1202
"Science AMA Series: I am Anant Agarwal; I'm teaching MIT's 6.002x Circuits and Electronics, while working to bring courses like 6.002x to students around the world in my role as CEO of edX. Ask me anything!",/r/science,"Monday, January 26, 2015 at 4:49:37 AM PST",4870,429
"Science AMA Series: We created a map of reddit to make it easier for you to discover new communities. We are Drs. Zachary Neal and Randy Olson from Michigan State University, Ask Us Anything!",/r/science,"Thursday, August 6, 2015 at 4:47:25 AM PDT",4859,286
"Killer robot concerns lead to boycott of top South Korean university: More than 50 top Artificial Intelligence researchers on Wednesday announced a boycott of South Korea's top university, after it opened what they called an AI weapons lab with one of South Korea's largest companies.",/r/worldnews,"Thursday, April 5, 2018 at 2:30:56 AM PDT",4856,449
A.I.,/r/HFY,"Thursday, February 11, 2021 at 11:05:45 AM PST",4826,125
Scientists use AI to discover new antibiotic to treat deadly superbug | Artificial intelligence (AI),/r/Futurology,"Saturday, May 27, 2023 at 3:54:12 AM PDT",4814,135
My boyfriend (28 M) said he doesn't want to have sex with me (25 F) anymore.,/r/BestofRedditorUpdates,"Saturday, October 14, 2023 at 9:03:12 PM PDT",4811,329
ChatGPT's deepest secret revealed 😮,/r/ChatGPT,"Saturday, April 29, 2023 at 4:41:43 PM PDT",4805,145
The Nature of Predators 74,/r/HFY,"Wednesday, December 21, 2022 at 7:04:54 AM PST",4796,379
"OOP - I don't like the relationship between my husband and his ""work wife"", and neither does her partner. + NEW UPDATE.",/r/BestofRedditorUpdates,"Tuesday, November 15, 2022 at 7:46:26 AM PST",4761,249
[GIVEAWAY] Giving away 10 deskmats from the AI Collection! Every single design is generated by Artificial Intelligence,/r/pcmasterrace,"Monday, August 1, 2022 at 2:47:22 AM PDT",14553,10593
"I Am an Artificial ""Hive Mind"" called UNU. I correctly picked the Superfecta at the Kentucky Derby—the 1st, 2nd, 3rd, and 4th place horses in order. A reporter from TechRepublic bet $1 on my prediction and won $542. Today I'm answering questions about U.S. Politics. Ask me anything...",/r/IAmA,"Wednesday, June 1, 2016 at 9:34:53 AM PDT",24855,9548
"From the late 2000s to the mid-2010s, I worked as a molecular biologist for a national security contractor in a program to study Exo-Biospheric-Organisms (EBO). I will share with you a lot of information on this subject. Feel free to ask questions or ask for clarification",/r/aliens,"Wednesday, July 5, 2023 at 3:15:22 PM PDT",19885,9472
[Megathread] President Trump’s Address on Border Security and the Democratic Response (Part 2),/r/politics,"Tuesday, January 8, 2019 at 6:57:55 PM PST",4330,8767
We create a sentient artificial intelligence and the first thing it does is switch itself off. How does the world react?,/r/AskReddit,"Sunday, March 29, 2020 at 4:50:56 AM PDT",65558,5614
"Elon Musk issues a stark warning about A.I., calls it a bigger threat than North Korea: Tesla's billionaire CEO renewed his critique of artificial intelligence, saying that if you're not concerned, 'you should be.'",/r/worldnews,"Sunday, August 13, 2017 at 10:48:41 AM PDT",35716,4777
"We’re 3 female computer scientists at MIT, here to answer questions about programming and academia. Ask us anything!",/r/IAmA,"Friday, December 12, 2014 at 10:30:09 AM PST",6402,4455
"Racism leads to science that is biased, exclusionary, and even harmful. We’re experts on the ways racism and lack of diversity harms STEM and perpetuates inequalities - let’s discuss!",/r/science,"Thursday, August 27, 2020 at 6:14:49 AM PDT",29665,3979
"Musk, Wozniak and Hawking urge ban on AI and autonomous weapons: Over 1,000 high-profile artificial intelligence experts and leading researchers have signed an open letter warning of a “military artificial intelligence arms race” and calling for a ban on “offensive autonomous weapons”.",/r/worldnews,"Monday, July 27, 2015 at 3:36:45 AM PDT",29410,3505
Demolition Man is one of the most critically underaclaimed movies of all time.,/r/movies,"Thursday, November 4, 2021 at 4:59:59 AM PDT",23782,3500
Stephen Hawking warns artificial intelligence could end mankind.,/r/technology,"Tuesday, December 2, 2014 at 5:23:42 AM PST",11321,3403
"Hey reddit, it's me Haley Joel Osment, here to answer your questions.",/r/IAmA,"Thursday, January 16, 2014 at 11:05:42 AM PST",2436,3254
"Artificial intelligence could leave half the world unemployed, says expert",/r/technology,"Saturday, February 13, 2016 at 7:47:05 AM PST",8553,3230
Official Discussion - The Creator [SPOILERS],/r/movies,"Thursday, September 28, 2023 at 7:08:46 PM PDT",685,3208
Science AMA Series: Stephen Hawking AMA Answers!,/r/science,"Thursday, October 8, 2015 at 4:58:39 AM PDT",20684,3154
"Where's the No Man's Sky we were sold on? A BIG list of things that are missing with sources, links and quotes. Also, dubious advertisement (x-post from r/nomansskythegame)",/r/Games,"Tuesday, August 16, 2016 at 12:52:38 PM PDT",14656,2985
"Robots won't just take our jobs – they'll make the rich even richer: ""Robotics and artificial intelligence will continue to improve – but without political change such as a tax, the outcome will range from bad to apocalyptic""",/r/Futurology,"Thursday, March 2, 2017 at 3:32:31 AM PST",19309,2867
"Riot's ""Sandbox Mode"" reply makes it obvious how little they seem to understand the competitive setting of their game.",/r/leagueoflegends,"Wednesday, August 5, 2015 at 3:54:16 PM PDT",11327,2850
