Title,Subreddit,Date,Votes,Comments
"Women are perceived differently from men — even when they're robots. Female bots are perceived to have more positive human qualities, such as warmth, experience and emotion, than male bots, and this greater humanness leads consumers to prefer female artificial intelligence, a new study has found.",/r/science,"Friday, April 2, 2021 at 2:51:45 AM PDT",50538,2803
So it turns out the OpenAI drama really was about a superintelligence breakthrough,/r/ChatGPT,"Wednesday, November 22, 2023 at 4:00:16 PM PST",6328,2823
"""Facebook sucks""—Elon Musk hits back at Facebook AI head who claimed Tesla boss has ""no idea"" about artificial intelligence",/r/technology,"Thursday, May 14, 2020 at 6:15:09 PM PDT",21538,2715
"TIL Evangelist Ray Comfort recorded a video arguing the banana displayed many user-friendly features that were evidence of intelligent design. Comfort retracted the video upon learning that the banana is a result of artificial selection by humans, and that the wild banana is small and unpalatable.",/r/todayilearned,"Friday, November 18, 2016 at 12:00:06 AM PST",26273,2692
Official Discussion - Space Jam: A New Legacy [SPOILERS],/r/movies,"Friday, July 16, 2021 at 5:00:44 PM PDT",927,2603
Atlas Rises Update v1.3,/r/NoMansSkyTheGame,"Friday, August 11, 2017 at 3:18:38 AM PDT",5444,2559
"I’m Eugene Kaspersky, cybersecurity guy and CEO of Kaspersky Lab! Ask me Anything!",/r/IAmA,"Thursday, May 11, 2017 at 5:30:31 AM PDT",10701,2515
Official Discussion: Ex Machina [SPOILERS],/r/movies,"Thursday, April 23, 2015 at 6:43:57 PM PDT",800,2403
"The Future is Yesterday For Us ""Bottom Feeders""",/r/antiwork,"Saturday, January 21, 2023 at 8:40:47 AM PST",16405,2386
"Holy shit. I was skeptical of all the high ceilings being thrown out until I put the pieces together. I honestly think GME is priceless, and the most valuable stock you will ever buy. Here's the full picture, as I understand it...",/r/Superstonk,"Wednesday, April 21, 2021 at 3:28:30 AM PDT",23830,2362
"""We need to rethink the very basic structure of our economic system. For example, we may have to consider instituting a Basic Income Guarantee."" - Dr. Moshe Vardi, a computer scientist who has studied automation and artificial intelligence (AI) for more than 30 years",/r/Futurology,"Thursday, February 18, 2016 at 2:36:44 PM PST",5765,2358
Artificial intelligence researchers taught an AI to decide who a self-driving car should kill by feeding it millions of human survey responses,/r/Futurology,"Monday, October 16, 2017 at 8:58:25 AM PDT",12257,2334
"Science AMA Series: We are evolution researchers at Harvard University, working on a broad range of topics, like the origin of life, viruses, social insects, cancer, and cooperation. Today is Charles Darwin’s birthday, and we’re here to talk about evolution. AMA!",/r/science,"Sunday, February 12, 2017 at 5:05:39 AM PST",12022,2254
"Robots won't just take our jobs – they'll make the rich even richer: ""Robotics and artificial intelligence will continue to improve – but without political change such as a tax, the outcome will range from bad to apocalyptic""",/r/technology,"Thursday, March 2, 2017 at 3:33:05 AM PST",13078,2218
Google’s Allegedly Sentient Artificial Intelligence Has Hired An Attorney,/r/technology,"Wednesday, July 6, 2022 at 8:09:23 PM PDT",15056,2161
"Artificial Intelligence Is Likely to Make a Career in Finance, Medicine or Law a Lot Less Lucrative",/r/Futurology,"Saturday, August 12, 2017 at 10:40:12 AM PDT",17515,2191
ChatGPT is just the beginning: Artificial intelligence is ready to transform the world,/r/Futurology,"Wednesday, February 1, 2023 at 6:18:32 AM PST",14955,2131
GPT-4 Week 3. Chatbots are yesterdays news. AI Agents are the future. The beginning of the proto-agi era is here,/r/ChatGPT,"Thursday, April 6, 2023 at 5:10:39 AM PDT",13125,2115
"I’m Tim Urban, writer of the blog Wait But Why. AMA!",/r/IAmA,"Thursday, March 30, 2023 at 7:38:37 AM PDT",3981,2101
"I am Luke Muehlhauser, CEO of the Singularity Institute for Artificial Intelligence. Ask me anything about the Singularity, AI progress, technological forecasting, and researching Friendly AI!",/r/Futurology,"Wednesday, August 15, 2012 at 9:01:27 AM PDT",1407,2097
Bill Gates warns that artificial intelligence can attack humans,/r/Futurology,"Sunday, March 26, 2023 at 6:55:43 PM PDT",14188,2062
One of the creators of ChatGPT said that the development of AI could lead to disaster,/r/Futurology,"Monday, May 1, 2023 at 1:06:43 AM PDT",8391,1989
"The Pentagon promises to use artificial intelligence for good, not evil",/r/nottheonion,"Tuesday, February 25, 2020 at 8:25:00 AM PST",42366,1962
Halo Infinite Campaign Reviews Megathread,/r/halo,"Monday, December 6, 2021 at 12:33:27 AM PST",2077,1908
Final Fantasy XVI Review Thread,/r/Games,"Wednesday, June 21, 2023 at 7:00:48 AM PDT",2323,1915
"TIL that Jurassic Park's visual effects were so groundbreaking to filmmakers that it inspired George Lucas to start working on the Star Wars prequels, Stanley Kubrick to invest in pet project, A.I Artificial Intelligence, and Peter Jackson to work on Lord of the Rings.",/r/todayilearned,"Thursday, June 16, 2016 at 1:39:48 PM PDT",36531,1910
"Science AMA Series: We study how intelligent machines can help us (think of a car that could park itself after dropping you off) while at the same time they threaten to radically disrupt our economic lives (truckers, bus drivers, and even airline pilots who may be out of a job). Ask us anything!",/r/science,"Saturday, February 13, 2016 at 4:34:19 AM PST",5927,1889
[Megathread] Wuhan viral outbreak,/r/China,"Thursday, January 23, 2020 at 8:57:17 AM PST",508,1881
"Google's artificial intelligence program has officially beaten a human professional Go player, marking the first time a computer has beaten a human professional in this game sans handicap.",/r/science,"Wednesday, January 27, 2016 at 2:45:11 PM PST",16272,1813
"I don't like the relationship between my husband and his ""work wife"", and neither does her partner.",/r/TrueOffMyChest,"Thursday, October 20, 2022 at 4:56:16 PM PDT",16795,1790
"Science AMA Series: I'm Joanna Bryson, a Professor in Artificial (and Natural) Intelligence. I am being consulted by several governments on AI ethics, particularly on the obligations of AI developers towards AI and society. I'd love to talk – AMA!",/r/science,"Friday, January 13, 2017 at 4:39:55 AM PST",9567,1767
[Megathread] We welcome our new AI overlords. Introducing the new AI ad campaign for Myrtle Beach.,/u/Visitmyrtlebeach,"Tuesday, August 22, 2023 at 1:34:00 PM PDT",4096,1769
“please do not misinterpret this in a racist way“,/r/facepalm,"Tuesday, September 13, 2022 at 4:53:53 AM PDT",7120,1755
"Artificial Intelligence: World is ‘'astonishingly pessimistic,’ says EU research commissioner. Media are too full of ‘alarmist, hysterical’ doomsday scenarios, says Carlos Moedas, as EU looks at ways to block flow of online misinformation",/r/Futurology,"Thursday, November 23, 2017 at 12:12:19 PM PST",16305,1766
"TIL that Jurassic Park's visual effects were so groundbreaking to filmmakers that it inspired Peter Jackson to begin work on Lord of the Rings, George Lucas to start on the Star Wars prequels, and Stanley Kubrick to invest in his pet project, A.I (Artificial Intelligence). Jurassic Park (film)",/r/todayilearned,"Sunday, December 20, 2020 at 10:20:00 PM PST",60404,1738
Artists Are Suing Artificial Intelligence Companies and the Lawsuit Could Upend Legal Precedents Around Art,/r/Futurology,"Saturday, May 13, 2023 at 12:15:41 PM PDT",7959,1736
Goldman Sachs Predicts 300 Million Jobs Will Be Lost Or Degraded By Artificial Intelligence,/r/Futurology,"Saturday, June 10, 2023 at 3:14:57 PM PDT",8097,1717
"If humans were ever to prove the theory that our universe is a simulation, it would simultaneously become the moment when artificial intelligence becomes self-aware, ironically making humanity the artificial intelligence all along.",/r/Showerthoughts,"Friday, December 28, 2018 at 4:15:05 AM PST",80251,1681
"Stephen hawking is doing an AMA Monday July 27 at 8am ET through Tuesday, August 4. The renowned physicist plans to discuss his concerns that artificial intelligence could one day outsmart mankind if we're not careful. Mark it in the books!",/r/Futurology,"Friday, July 24, 2015 at 9:35:48 AM PDT",16827,1658
"Just read Jurassic Park (1990) by Michael Crichton. The character ""Lex"" is very different from the movie adaptation. Also, a note on AI.",/r/books,"Wednesday, January 31, 2018 at 5:53:41 AM PST",8136,1608
Kingdom Come: Deliverance - Review Thread,/r/Games,"Tuesday, February 13, 2018 at 12:01:21 AM PST",2146,1541
[Scene] Planet Persephone,/r/ExploreFiction,"Saturday, January 18, 2014 at 2:14:11 PM PST",7,1545
"Extraterrestrial intelligence is more likely to be artificial than biological, argues Martin Rees, UK's Astronomer Royal",/r/space,"Thursday, September 15, 2022 at 9:23:59 AM PDT",14037,1521
Artificially Intelligent Lawyer “Ross” Has Been Hired By Its First Official Law Firm,/r/Futurology,"Thursday, May 12, 2016 at 3:51:57 AM PDT",15456,1534
"Sony patents a new system of backward compatibility of PS5 with PS4, PS3, PS2 and PSX",/r/PS4,"Friday, February 1, 2019 at 4:27:38 AM PST",19737,1527
Elon Musk nominated for 'luddite' of the year prize over artificial intelligence fears,/r/nottheonion,"Thursday, December 24, 2015 at 1:52:41 AM PST",3994,1488
Games with *strong* messages?,/r/Games,"Sunday, February 9, 2014 at 6:13:10 AM PST",1215,1442
Performers Worry Artificial Intelligence Will Take Their Jobs,/r/Futurology,"Saturday, June 10, 2023 at 3:38:00 AM PDT",4405,1429
"We are Oasis - the leading privacy-enabled, layer-1 blockchain for DeFi and Data Tokenization. Our backers include Polychain, Pantera, Dragonfly & we have established partnerships with companies like Genetica, Nebula, BMW, Binance and more! Ask us anything! We’re giving away $5,000 USD in $ROSE",/r/CryptoCurrency,"Wednesday, November 17, 2021 at 5:07:32 AM PST",595,1382
We are PhD students from Harvard University here to answer questions about artificial intelligence and cognition. Ask us anything!,/r/IAmA,"Saturday, July 29, 2017 at 9:31:56 AM PDT",11795,1388
"AAAS AMA: Hi, we’re researchers from Google, Microsoft, and Facebook who study Artificial Intelligence. Ask us anything!",/r/science,"Sunday, February 18, 2018 at 6:16:18 AM PST",7695,1304
Google engineer thinks artificial intelligence bot has become sentient,/r/technology,"Sunday, June 12, 2022 at 4:06:08 AM PDT",2804,1275
I fucking hate this conspiracy theory bullshit,/r/TrueOffMyChest,"Monday, October 19, 2020 at 7:35:40 AM PDT",14212,1272
Tech leaders urge a pause in the 'out-of-control' artificial intelligence race,/r/Futurology,"Wednesday, March 29, 2023 at 8:20:25 PM PDT",7155,1276
Nasa to hold major announcement after artificial intelligence makes major planet-hunting breakthrough,/r/Futurology,"Monday, December 11, 2017 at 4:30:42 AM PST",29802,1273
Google has a secret new project that is teaching artificial intelligence to write and fix code. It could reduce the need for human engineers in the future.,/r/technology,"Wednesday, November 23, 2022 at 5:22:20 AM PST",7280,1238
DeepMind just published a mind blowing paper - PathNet - potentially describing how general artificial intelligence will look like.,/r/Futurology,"Thursday, March 9, 2017 at 3:28:06 AM PST",9955,1235
"In 1999, my mother took a $12/hour H-1B visa job so we could escape gun violence in South Africa. I'm now the CEO of a startup that uses AI to save lives during active shooter incidents. AMA!",/r/IAmA,"Tuesday, June 7, 2022 at 8:59:01 AM PDT",12798,1184
"Artificial intelligence will wipe out half the banking jobs in a decade, experts say",/r/technology,"Friday, April 20, 2018 at 2:54:20 PM PDT",11237,1208
"Science Discussion Series: How do redlining, poorer performing schools, lack of access to resources and the physical environment contribute to inequity? We’re experts on the economic and social impacts of race - let’s discuss!",/r/science,"Tuesday, August 25, 2020 at 6:11:40 AM PDT",16459,1196
"The 4th Industrial Revolution, which includes developments in artificial intelligence and machine-learning, robotics, nanotech, 3D printing, and genetics and biotech, will cause widespread disruption to labour markets over the next 5 years, with enormous changes in the skill sets needed to thrive.",/r/Futurology,"Wednesday, January 20, 2016 at 12:57:56 PM PST",6050,1209
"I'm Professor Toby Walsh, a leading artificial intelligence researcher investigating the impacts of AI on society. Ask me anything about AI, ChatGPT, technology and the future!",/r/IAmA,"Monday, January 30, 2023 at 3:45:47 PM PST",4895,1202
The “not real” person the woman saw on the plane was a humanoid artificial intelligence,/r/conspiracy,"Wednesday, July 5, 2023 at 3:53:32 AM PDT",1364,1201
"You often hear ""the movie was great, but the ending ruined it for me"". How many bad movies are saved by a good ending?",/r/movies,"Friday, May 28, 2021 at 9:11:36 AM PDT",958,1192
"TIL Elon Musk, Stephen Hawking, and Steve Wozniak have all signed an open letter for a ban on Artificially Intelligent weapons.",/r/todayilearned,"Friday, March 3, 2017 at 3:01:24 PM PST",27195,1191
"I used deep learning to guess your SR, estimate you SR for each hero, and give advice on how to get better at Overwatch!",/r/Overwatch,"Tuesday, August 22, 2017 at 10:41:35 AM PDT",2268,1177
Google says its artificial intelligence is faster and better than humans at laying out chips for artificial intelligence,/r/Futurology,"Thursday, June 10, 2021 at 4:42:58 AM PDT",16191,1160
[OC] Artificial Intelligence hype is currently at its peak. Metaverse rose and fell the quickest.,/r/dataisbeautiful,"Thursday, October 19, 2023 at 5:10:50 AM PDT",8458,1140
Do you want Diamond level bots?,/r/leagueoflegends,"Monday, December 23, 2013 at 11:37:20 PM PST",1874,1126
"I Am an Artificial ""Hive Mind"" named UNU. I’ve made headlines for sports predictions like the Kentucky Derby, where I picked the Superfecta—1st, 2nd, 3rd, 4th place horses in order. In June I was the 1st ever Hive Mind A.I. to do an AMA. Today I’ll be talking NFL & FANTASY FOOTBALL. Ask me anything.",/r/IAmA,"Wednesday, August 31, 2016 at 9:52:42 AM PDT",2902,1120
I sent an email to the professor who laughed me out of a machine learning seminar two years ago,/r/TwoXChromosomes,"Thursday, August 13, 2020 at 2:53:13 PM PDT",36149,1112
"Sony patents a new system of backward compatibility of PS5 with PS4, PS3, PS2 and PSX",/r/Games,"Friday, February 1, 2019 at 4:25:59 AM PST",10353,1111
'The Godfather of A.I.' warns of 'nightmare scenario' where artificial intelligence begins to seek power,/r/Futurology,"Tuesday, May 2, 2023 at 6:32:35 AM PDT",5953,1108
NieR Replicant ver.1.22474487139 - Review Thread,/r/Games,"Thursday, April 22, 2021 at 5:22:20 AM PDT",2659,1092
"""42% of CEOs say AI could destroy humanity in five to ten years""",/r/ChatGPT,"Wednesday, June 14, 2023 at 12:51:39 PM PDT",3162,1096
The Real Reason Elon Musk Bought Twitter and why that is a HUGE PROBLEM!,/r/wallstreetbets,"Thursday, April 28, 2022 at 5:11:47 PM PDT",5242,1081
"Tesla CEO Elon Musk says social media, artificial intelligence should be regulated",/r/Futurology,"Wednesday, April 11, 2018 at 6:00:06 AM PDT",27502,1062
Silicon Valley billionaires buy underground bunkers preparing for the apocalypse: Tech entrepreneurs fearful artificial intelligence will displace so many jobs there will be a revolt against those responsible,/r/Futurology,"Thursday, January 26, 2017 at 8:13:27 PM PST",5747,1055
"TIL: In 1982 Xerox management watched a film of people struggling to use their new copier and laughed that they must have been grabbed off a loading dock. The people struggling were Ron Kaplan, a computational linguist, and Allen Newell, a founding father of artificial intelligence.",/r/todayilearned,"Friday, January 25, 2019 at 5:57:15 AM PST",32406,1049
US patent office rules that artificial intelligence cannot legally be an inventor,/r/Futurology,"Thursday, April 30, 2020 at 7:26:54 AM PDT",23812,1045
Frequently Asked Questions(FAQ),/r/LotoBlock,"Tuesday, June 26, 2018 at 8:35:05 AM PDT",759,1038
"PLOS Science Wednesday: Hi Reddit, we create computational models for artificial intelligence. Ask us anything!",/r/science,"Wednesday, May 13, 2015 at 4:41:23 AM PDT",3333,1022
Review Megathread - Alita: Battle Angel,/r/movies,"Thursday, January 31, 2019 at 3:23:50 PM PST",711,1020
Falsely accused of using CHATGPT by professor.,/r/ChatGPT,"Wednesday, July 19, 2023 at 11:44:43 AM PDT",4136,1020
A perspective on transgender athletes in disc golf.,/r/discgolf,"Sunday, May 14, 2023 at 1:33:20 PM PDT",767,1007
Synopsis for 04-12-2021 what we need to know before the market opens DD,/r/Superstonk,"Monday, April 12, 2021 at 2:31:50 AM PDT",13355,1000
Elon Musk and Stephen Hawking calling for a ban of artificially intelligent weapons,/r/Futurology,"Friday, July 31, 2015 at 5:38:37 PM PDT",6704,999
"An artificial intelligence program has been developed that is better at spotting breast cancer in mammograms than expert radiologists. The AI outperformed the specialists by detecting cancers that the radiologists missed in the images, while ignoring features they falsely flagged",/r/worldnews,"Wednesday, January 1, 2020 at 10:19:33 AM PST",21718,982
Tesla boss Elon Musk warns artificial intelligence development is 'summoning the demon',/r/worldnews,"Sunday, October 26, 2014 at 7:51:28 PM PDT",1439,982
"AskScience AMA Series: I am Jerry Kaplan, Artificial Intelligence expert and author here to answer your questions. Ask me anything!",/r/askscience,"Tuesday, November 22, 2016 at 5:19:28 AM PST",3150,970
"TIL the first thing ever bought and sold across the Internet was a bag of marijuana. In 1971 or 1972, students at Stanford University’s Artificial Intelligence Laboratory used ARPANET—the earliest iteration of the Internet—to arrange a marijuana deal with their counterparts at the MIT",/r/todayilearned,"Monday, December 15, 2014 at 4:26:55 AM PST",23376,960
What’s something that Artificial Intelligence will never be able to do?,/r/AskReddit,"Tuesday, October 10, 2023 at 8:40:11 PM PDT",418,945
Anyone else feel annoyed that they're going to miss out on the future's inventions?,/r/NoStupidQuestions,"Thursday, May 7, 2020 at 5:23:16 PM PDT",13120,941
"Musk, Wozniak and Hawking urge ban on AI and autonomous weapons: Over 1,000 high-profile artificial intelligence experts and leading researchers have signed an open letter warning of a “military artificial intelligence arms race” and calling for a ban on “offensive autonomous weapons”.",/r/news,"Monday, July 27, 2015 at 4:20:03 AM PDT",6718,931
The Aqua Belt Part 2: The Battle of Auction Day,/r/StrawHatRPG,"Monday, March 30, 2020 at 5:30:19 PM PDT",9,930
"Artificial Intelligence Creates Realistic Photos of People, None of Whom Actually Exist",/r/technology,"Tuesday, December 25, 2018 at 5:44:06 PM PST",18020,918
"Saudi Arabia recently announced plans for a $500 billion techutopia mega-city Neom, with 100% solar energy, fully autonomous transportation, hydroponic farms, artificial intelligence, and advanced manufacturing, open to all races and religions - a “new civilization.”",/r/Futurology,"Sunday, December 24, 2017 at 3:00:25 AM PST",11782,930
My brother (11) wants to get into programming but is unsure if it is worth it due to the rise of AI. Recommendations?,/r/ChatGPT,"Thursday, July 20, 2023 at 2:02:47 PM PDT",1180,929
"Scientists at Oxford say they've invented an artificial intelligence system that can lip-read better than humans. The system, which has been trained on thousands of hours of BBC News programmes, has been developed in collaboration with Google's DeepMind AI division.",/r/technology,"Friday, March 17, 2017 at 3:19:51 AM PDT",20170,915
"Science AMA Series: I’m Maxim Makukov, a researcher in astrobiology and astrophysics and a co-author of the papers which claim to have identified extraterrestrial signal in the universal genetic code thereby confirming directed panspermia. AMA!",/r/science,"Saturday, October 4, 2014 at 5:48:33 AM PDT",4550,924
Bungie Weekly Update - 10/22/2015,/r/DestinyTheGame,"Thursday, October 22, 2015 at 3:10:12 PM PDT",390,919
"CMV: Using race as a factor in U.S. college admissions is, under all circumstances, wrong.",/r/changemyview,"Sunday, March 24, 2019 at 10:06:53 PM PDT",3540,915
[Official Press Release] MoviePass Accelerates Plan For Profitability,/r/MoviePassClub,"Tuesday, July 31, 2018 at 6:42:03 AM PDT",249,906
"AMA Request: Watson (artificial intelligence computer system, capable of answering questions posed in natural language)",/r/IAmA,"Saturday, September 29, 2012 at 2:18:50 PM PDT",2787,899
[Official Press Release] MoviePass™ Launches New Pricing Plan Built for The Mass Consumer,/r/MoviePassClub,"Monday, August 6, 2018 at 6:44:02 AM PDT",193,898
[MEGATHREAD] Neuralink Event (8/28 3pm PST),/r/Neuralink,"Friday, August 28, 2020 at 8:00:16 AM PDT",246,884
China Is What Orwell Feared: Xi Jinping is using artificial intelligence to enhance his government’s totalitarian control—and he’s exporting this technology to regimes around the globe.,/r/Futurology,"Wednesday, July 29, 2020 at 6:17:16 AM PDT",17216,896
"Jack Ma: We need to stop training our kids for manufacturing jobs - ""because of the artificial intelligence, because of the robots -- manufacturing is no longer the main engine of creating jobs""",/r/Futurology,"Wednesday, September 20, 2017 at 9:49:33 PM PDT",11068,888
Artificial intelligence researchers must learn ethics,/r/philosophy,"Thursday, July 19, 2018 at 7:55:33 AM PDT",7966,870
OpenAI CEO suggests international agency like UN's nuclear watchdog could oversee AI,/r/ChatGPT,"Wednesday, June 7, 2023 at 7:31:37 AM PDT",3623,882
ELI5: How do we know what the universe looks like today when all the light we see is from millions or billions of years ago?,/r/explainlikeimfive,"Tuesday, April 22, 2014 at 9:32:23 AM PDT",1794,857
"Artificial intelligence system could help counter the spread of disinformation. Built at MIT Lincoln Laboratory, the RIO program automatically detects and analyzes social media accounts that spread disinformation across a network",/r/Futurology,"Thursday, May 27, 2021 at 5:08:26 PM PDT",11405,863
Exclusive Whitelist Opportunity for Unique NFT,/r/iguverse_official,"Tuesday, August 30, 2022 at 11:37:23 AM PDT",481,860
What’s up with Google LaMDA being “sentient”?,/r/OutOfTheLoop,"Sunday, June 12, 2022 at 8:42:34 PM PDT",3160,863
Artificial intelligence based translator of American sign language.,/r/interestingasfuck,"Tuesday, June 15, 2021 at 7:30:52 AM PDT",77913,850
"Evening random discussion - Aug 02, 2021",/r/Philippines,"Monday, August 2, 2021 at 2:55:01 AM PDT",27,835
Westworld creator on the future of AI: ‘We’ll be lucky if the future looks like Westworld’ - ‘We shouldn’t be scared of artificial intelligence; we should be scared of artificial stupidity’,/r/Futurology,"Tuesday, June 12, 2018 at 6:50:49 PM PDT",17576,835
Auto valet parking with robots and artificial intelligence in China,/r/nextfuckinglevel,"Wednesday, June 14, 2023 at 8:25:46 AM PDT",17744,831
Regarding recent posts about AI voice generation,/r/skyrimmods,"Wednesday, April 19, 2023 at 3:18:18 AM PDT",472,831
"I'm currently watching Northern Exposure (1990-1995), a show that is almost completely unknown to people under 30 but was decades ahead of its time in tackling social issues and still relevant today. It's also extremely funny.",/r/television,"Sunday, March 17, 2019 at 8:28:55 PM PDT",6967,826
March 19 is NOT likely to be Lift Off,/r/GME,"Sunday, February 28, 2021 at 12:05:33 PM PST",4205,816
"Elon Musk announces the formation of a new Artificial Intelligence research company, OpenAI",/r/technology,"Friday, December 11, 2015 at 1:55:20 PM PST",5827,813
Germany considers banning ChatGPT: The entire European Union could be next.,/r/ChatGPT,"Tuesday, April 4, 2023 at 6:55:30 AM PDT",1130,815
"Looking for Movies Similar to Contact (1997), Interstellar (2014), Arrival (2016), etc.",/r/movies,"Monday, January 31, 2022 at 5:31:03 AM PST",944,811
An artificial intelligence has debated with humans about the the dangers of AI – narrowly convincing audience members that AI will do more good than harm.,/r/Futurology,"Sunday, November 24, 2019 at 1:38:28 PM PST",13287,796
EDIT - everything tastes better crispr,/r/wallstreetbets,"Saturday, April 10, 2021 at 1:46:08 PM PDT",2554,797
"A programmer is suing Microsoft, GitHub and OpenAI over artificial intelligence technology that generates its own computer code. Coders join artists in trying to halt the inevitable.",/r/Futurology,"Thursday, November 24, 2022 at 12:36:08 AM PST",6716,793
Society is absolutely asleep at the wheel in regards to the impact LLM's & AGI are going to have on the working class.,/r/collapse,"Thursday, April 6, 2023 at 3:53:31 PM PDT",1283,790
Brain activity decoder can reveal stories in people’s minds. Artificial intelligence system can translate a person’s brain activity into a continuous stream of text.,/r/science,"Monday, May 1, 2023 at 8:51:17 AM PDT",9449,783
The dangers of Musk’s Neuralink | The merger of human intelligence and artificial intelligence sought by Musk would be as much an artificialization of the human as a humanization of the machine.,/r/philosophy,"Monday, April 25, 2022 at 4:34:54 AM PDT",3090,782
This Week at Bungie - 4/13/2023,/r/DestinyTheGame,"Thursday, April 13, 2023 at 11:04:52 AM PDT",587,764
