Title,Subreddit,Date,Votes,Comments
"If humans were ever to prove the theory that our universe is a simulation, it would simultaneously become the moment when artificial intelligence becomes self-aware, ironically making humanity the artificial intelligence all along.",/r/Showerthoughts,"Friday, December 28, 2018 at 4:15:05 AM PST",80251,1681
Artificial intelligence based translator of American sign language.,/r/interestingasfuck,"Tuesday, June 15, 2021 at 7:30:52 AM PDT",77913,850
We create a sentient artificial intelligence and the first thing it does is switch itself off. How does the world react?,/r/AskReddit,"Sunday, March 29, 2020 at 4:50:56 AM PDT",65558,5614
"TIL that Jurassic Park's visual effects were so groundbreaking to filmmakers that it inspired Peter Jackson to begin work on Lord of the Rings, George Lucas to start on the Star Wars prequels, and Stanley Kubrick to invest in his pet project, A.I (Artificial Intelligence). Jurassic Park (film)",/r/todayilearned,"Sunday, December 20, 2020 at 10:20:00 PM PST",60404,1738
Artificial Intelligence,/r/WhitePeopleTwitter,"Saturday, December 9, 2017 at 7:40:42 AM PST",53198,425
"Women are perceived differently from men — even when they're robots. Female bots are perceived to have more positive human qualities, such as warmth, experience and emotion, than male bots, and this greater humanness leads consumers to prefer female artificial intelligence, a new study has found.",/r/science,"Friday, April 2, 2021 at 2:51:45 AM PDT",50538,2803
"The Pentagon promises to use artificial intelligence for good, not evil",/r/nottheonion,"Tuesday, February 25, 2020 at 8:25:00 AM PST",42366,1962
"TIL that Jurassic Park's visual effects were so groundbreaking to filmmakers that it inspired George Lucas to start working on the Star Wars prequels, Stanley Kubrick to invest in pet project, A.I Artificial Intelligence, and Peter Jackson to work on Lord of the Rings.",/r/todayilearned,"Thursday, June 16, 2016 at 1:39:48 PM PDT",36531,1910
I sent an email to the professor who laughed me out of a machine learning seminar two years ago,/r/TwoXChromosomes,"Thursday, August 13, 2020 at 2:53:13 PM PDT",36149,1112
Artificial intelligence supremacy,/r/memes,"Friday, June 4, 2021 at 5:38:55 AM PDT",36048,305
"Elon Musk issues a stark warning about A.I., calls it a bigger threat than North Korea: Tesla's billionaire CEO renewed his critique of artificial intelligence, saying that if you're not concerned, 'you should be.'",/r/worldnews,"Sunday, August 13, 2017 at 10:48:41 AM PDT",35716,4777
"Artificial Intelligence reconstruction of what Pharaoh Ramses II may have looked like (1,303 - 1,213 BC)",/r/interestingasfuck,"Monday, November 16, 2020 at 9:28:03 AM PST",34718,663
"TIL: In 1982 Xerox management watched a film of people struggling to use their new copier and laughed that they must have been grabbed off a loading dock. The people struggling were Ron Kaplan, a computational linguist, and Allen Newell, a founding father of artificial intelligence.",/r/todayilearned,"Friday, January 25, 2019 at 5:57:15 AM PST",32406,1049
Alan Turing creates Artificial Intelligence C.1950,/r/fakehistoryporn,"Wednesday, April 1, 2020 at 10:22:43 PM PDT",31971,238
"Researchers have identified a unique “breathprint” for 17 different diseases, such as kidney cancer or Parkinson’s disease, and have designed a device that screens breath samples with 86% accuracy using an array of nanoscale sensors and analyzing the results with artificial intelligence techniques.",/r/science,"Tuesday, December 27, 2016 at 4:23:46 AM PST",30599,604
Nasa to hold major announcement after artificial intelligence makes major planet-hunting breakthrough,/r/Futurology,"Monday, December 11, 2017 at 4:30:42 AM PST",29802,1273
"Racism leads to science that is biased, exclusionary, and even harmful. We’re experts on the ways racism and lack of diversity harms STEM and perpetuates inequalities - let’s discuss!",/r/science,"Thursday, August 27, 2020 at 6:14:49 AM PDT",29665,3979
"Musk, Wozniak and Hawking urge ban on AI and autonomous weapons: Over 1,000 high-profile artificial intelligence experts and leading researchers have signed an open letter warning of a “military artificial intelligence arms race” and calling for a ban on “offensive autonomous weapons”.",/r/worldnews,"Monday, July 27, 2015 at 3:36:45 AM PDT",29410,3505
Artificial intelligence it seems,/r/pcmasterrace,"Tuesday, February 5, 2019 at 9:50:44 PM PST",28769,652
Aintelligence,/r/suicidebywords,"Thursday, September 22, 2022 at 9:48:26 AM PDT",28661,67
"Tesla CEO Elon Musk says social media, artificial intelligence should be regulated",/r/Futurology,"Wednesday, April 11, 2018 at 6:00:06 AM PDT",27502,1062
"TIL Elon Musk, Stephen Hawking, and Steve Wozniak have all signed an open letter for a ban on Artificially Intelligent weapons.",/r/todayilearned,"Friday, March 3, 2017 at 3:01:24 PM PST",27195,1191
Artificial Intelligence Finds Hidden Roads Threatening Amazon Ecosystems - Researchers in Brazil are hunting for unofficial roads -- many of them illegal -- tied to rainforest destruction.,/r/Futurology,"Saturday, January 9, 2021 at 10:29:59 AM PST",26658,358
"TIL Evangelist Ray Comfort recorded a video arguing the banana displayed many user-friendly features that were evidence of intelligent design. Comfort retracted the video upon learning that the banana is a result of artificial selection by humans, and that the wild banana is small and unpalatable.",/r/todayilearned,"Friday, November 18, 2016 at 12:00:06 AM PST",26273,2692
Artificial Intelligence Can Detect Alzheimer’s Disease in Brain Scans Six Years Before a Diagnosis,/r/Futurology,"Thursday, January 3, 2019 at 5:12:39 AM PST",25082,465
"I Am an Artificial ""Hive Mind"" called UNU. I correctly picked the Superfecta at the Kentucky Derby—the 1st, 2nd, 3rd, and 4th place horses in order. A reporter from TechRepublic bet $1 on my prediction and won $542. Today I'm answering questions about U.S. Politics. Ask me anything...",/r/IAmA,"Wednesday, June 1, 2016 at 9:34:53 AM PDT",24855,9548
"Holy shit. I was skeptical of all the high ceilings being thrown out until I put the pieces together. I honestly think GME is priceless, and the most valuable stock you will ever buy. Here's the full picture, as I understand it...",/r/Superstonk,"Wednesday, April 21, 2021 at 3:28:30 AM PDT",23830,2362
US patent office rules that artificial intelligence cannot legally be an inventor,/r/Futurology,"Thursday, April 30, 2020 at 7:26:54 AM PDT",23812,1045
Demolition Man is one of the most critically underaclaimed movies of all time.,/r/movies,"Thursday, November 4, 2021 at 4:59:59 AM PDT",23782,3500
"TIL the first thing ever bought and sold across the Internet was a bag of marijuana. In 1971 or 1972, students at Stanford University’s Artificial Intelligence Laboratory used ARPANET—the earliest iteration of the Internet—to arrange a marijuana deal with their counterparts at the MIT",/r/todayilearned,"Monday, December 15, 2014 at 4:26:55 AM PST",23376,960
"An artificial intelligence program has been developed that is better at spotting breast cancer in mammograms than expert radiologists. The AI outperformed the specialists by detecting cancers that the radiologists missed in the images, while ignoring features they falsely flagged",/r/worldnews,"Wednesday, January 1, 2020 at 10:19:33 AM PST",21718,982
"""Facebook sucks""—Elon Musk hits back at Facebook AI head who claimed Tesla boss has ""no idea"" about artificial intelligence",/r/technology,"Thursday, May 14, 2020 at 6:15:09 PM PDT",21538,2715
Using artificial intelligence to reanimate one of the fathers of artificial intelligence,/r/Damnthatsinteresting,"Monday, January 24, 2022 at 3:10:37 AM PST",21059,283
Science AMA Series: Stephen Hawking AMA Answers!,/r/science,"Thursday, October 8, 2015 at 4:58:39 AM PDT",20684,3154
the end is nigh,/r/tumblr,"Sunday, March 5, 2023 at 8:57:31 AM PST",20615,159
Peak Artificial Intelligence Moment,/r/memes,"Monday, March 6, 2023 at 1:29:15 AM PST",20568,117
"Microsoft “AI For Earth” Project - $50 million over the next 5 years to democratize access to the climate change data available about the environment available from the thousands of land, sea, and atmospheric sensors in place around the world using AI or artificial intelligence.",/r/Futurology,"Friday, December 29, 2017 at 3:10:45 AM PST",20551,720
Artificial intelligence system detects often-missed cancer tumors,/r/Futurology,"Monday, August 27, 2018 at 4:09:53 AM PDT",20521,298
"Scientists at Oxford say they've invented an artificial intelligence system that can lip-read better than humans. The system, which has been trained on thousands of hours of BBC News programmes, has been developed in collaboration with Google's DeepMind AI division.",/r/technology,"Friday, March 17, 2017 at 3:19:51 AM PDT",20170,915
"From the late 2000s to the mid-2010s, I worked as a molecular biologist for a national security contractor in a program to study Exo-Biospheric-Organisms (EBO). I will share with you a lot of information on this subject. Feel free to ask questions or ask for clarification",/r/aliens,"Wednesday, July 5, 2023 at 3:15:22 PM PDT",19885,9472
"Sony patents a new system of backward compatibility of PS5 with PS4, PS3, PS2 and PSX",/r/PS4,"Friday, February 1, 2019 at 4:27:38 AM PST",19737,1527
"An artificial intelligence system correctly predicted the last 3 elections said Trump would win last week [it was right, Trump won, so 4 out of 4 so far]",/r/Futurology,"Wednesday, November 9, 2016 at 12:13:06 AM PST",19686,658
"Robots won't just take our jobs – they'll make the rich even richer: ""Robotics and artificial intelligence will continue to improve – but without political change such as a tax, the outcome will range from bad to apocalyptic""",/r/Futurology,"Thursday, March 2, 2017 at 3:32:31 AM PST",19309,2867
A crack in time saves nine,/r/ProgrammerHumor,"Tuesday, March 21, 2023 at 3:12:23 AM PDT",18720,115
South Korea Unveils $62 Billion ‘New Deal’ . The focus is to promote the use of fifth generation wireless networks and artificial intelligence across industries and foster digitalization in South Korea’s least developed areas. Investment will also support startups focusing on green technologies,/r/Futurology,"Monday, June 1, 2020 at 2:42:29 AM PDT",18218,388
Identity theft can be thwarted by artificial intelligence analysis of a user's mouse movements 95% of the time,/r/technology,"Sunday, June 11, 2017 at 3:05:50 AM PDT",18165,700
"Artificial Intelligence Creates Realistic Photos of People, None of Whom Actually Exist",/r/technology,"Tuesday, December 25, 2018 at 5:44:06 PM PST",18020,918
"""advanced artificial-intelligence""",/r/ProgrammerHumor,"Monday, October 29, 2018 at 11:47:21 PM PDT",17857,297
Auto valet parking with robots and artificial intelligence in China,/r/nextfuckinglevel,"Wednesday, June 14, 2023 at 8:25:46 AM PDT",17744,831
Westworld creator on the future of AI: ‘We’ll be lucky if the future looks like Westworld’ - ‘We shouldn’t be scared of artificial intelligence; we should be scared of artificial stupidity’,/r/Futurology,"Tuesday, June 12, 2018 at 6:50:49 PM PDT",17576,835
"Artificial Intelligence Is Likely to Make a Career in Finance, Medicine or Law a Lot Less Lucrative",/r/Futurology,"Saturday, August 12, 2017 at 10:40:12 AM PDT",17515,2191
China Is What Orwell Feared: Xi Jinping is using artificial intelligence to enhance his government’s totalitarian control—and he’s exporting this technology to regimes around the globe.,/r/Futurology,"Wednesday, July 29, 2020 at 6:17:16 AM PDT",17216,896
"Stephen hawking is doing an AMA Monday July 27 at 8am ET through Tuesday, August 4. The renowned physicist plans to discuss his concerns that artificial intelligence could one day outsmart mankind if we're not careful. Mark it in the books!",/r/Futurology,"Friday, July 24, 2015 at 9:35:48 AM PDT",16827,1658
"I don't like the relationship between my husband and his ""work wife"", and neither does her partner.",/r/TrueOffMyChest,"Thursday, October 20, 2022 at 4:56:16 PM PDT",16795,1790
"We've been locked in our classroom for days, and our teacher is starting to act very strange...",/r/nosleep,"Wednesday, October 5, 2022 at 5:48:20 AM PDT",16739,213
"Science Discussion Series: How do redlining, poorer performing schools, lack of access to resources and the physical environment contribute to inequity? We’re experts on the economic and social impacts of race - let’s discuss!",/r/science,"Tuesday, August 25, 2020 at 6:11:40 AM PDT",16459,1196
"The Future is Yesterday For Us ""Bottom Feeders""",/r/antiwork,"Saturday, January 21, 2023 at 8:40:47 AM PST",16405,2386
"Artificial Intelligence: World is ‘'astonishingly pessimistic,’ says EU research commissioner. Media are too full of ‘alarmist, hysterical’ doomsday scenarios, says Carlos Moedas, as EU looks at ways to block flow of online misinformation",/r/Futurology,"Thursday, November 23, 2017 at 12:12:19 PM PST",16305,1766
"Google's artificial intelligence program has officially beaten a human professional Go player, marking the first time a computer has beaten a human professional in this game sans handicap.",/r/science,"Wednesday, January 27, 2016 at 2:45:11 PM PST",16272,1813
Google says its artificial intelligence is faster and better than humans at laying out chips for artificial intelligence,/r/Futurology,"Thursday, June 10, 2021 at 4:42:58 AM PDT",16191,1160
Artificially Intelligent Lawyer “Ross” Has Been Hired By Its First Official Law Firm,/r/Futurology,"Thursday, May 12, 2016 at 3:51:57 AM PDT",15456,1534
I used Artificial Intelligence to make this Portrait of Felix based on The Wave by Hokusai,/r/PewdiepieSubmissions,"Tuesday, July 10, 2018 at 3:03:04 PM PDT",15328,292
Google’s Allegedly Sentient Artificial Intelligence Has Hired An Attorney,/r/technology,"Wednesday, July 6, 2022 at 8:09:23 PM PDT",15056,2161
ChatGPT is just the beginning: Artificial intelligence is ready to transform the world,/r/Futurology,"Wednesday, February 1, 2023 at 6:18:32 AM PST",14955,2131
The Real Problem With Artificial Intelligence,/r/funny,"Sunday, October 29, 2023 at 12:00:22 PM PDT",14956,111
"Happy birthday to Alan Turing, the father of artificial intelligence!",/r/pcmasterrace,"Wednesday, June 23, 2021 at 7:42:50 AM PDT",14917,362
Natural stupidity will kill us faster than Artificial Intelligence,/r/Showerthoughts,"Tuesday, December 24, 2019 at 7:27:20 AM PST",14694,227
"Where's the No Man's Sky we were sold on? A BIG list of things that are missing with sources, links and quotes. Also, dubious advertisement (x-post from r/nomansskythegame)",/r/Games,"Tuesday, August 16, 2016 at 12:52:38 PM PDT",14656,2985
Anon needs your advice,/r/greentext,"Monday, June 19, 2023 at 10:51:47 PM PDT",14629,181
[GIVEAWAY] Giving away 10 deskmats from the AI Collection! Every single design is generated by Artificial Intelligence,/r/pcmasterrace,"Monday, August 1, 2022 at 2:47:22 AM PDT",14553,10593
"The Prototype , Mother of all artificial intelligence",/r/Bossfight,"Saturday, April 22, 2023 at 2:47:19 AM PDT",14263,171
Anons discuss Artificial Intelligence,/r/4chan,"Monday, December 31, 2018 at 5:02:23 AM PST",14262,144
"“The greatest threat that humanity faces from artificial intelligence is not killer robots, but rather, our lack of willingness to analyze, name, and live to the values we want society to have today""",/r/Futurology,"Sunday, June 3, 2018 at 5:53:36 AM PDT",14255,615
I fucking hate this conspiracy theory bullshit,/r/TrueOffMyChest,"Monday, October 19, 2020 at 7:35:40 AM PDT",14212,1272
Bill Gates warns that artificial intelligence can attack humans,/r/Futurology,"Sunday, March 26, 2023 at 6:55:43 PM PDT",14188,2062
The Real Problem With Artificial Intelligence,/r/StandUpComedy,"Tuesday, October 17, 2023 at 8:28:08 AM PDT",14185,137
"Extraterrestrial intelligence is more likely to be artificial than biological, argues Martin Rees, UK's Astronomer Royal",/r/space,"Thursday, September 15, 2022 at 9:23:59 AM PDT",14037,1521
Robot uses artificial intelligence to cook burgers,/r/ProgrammerHumor,"Thursday, September 27, 2018 at 7:38:54 AM PDT",14004,293
Forget Chess—the Real Challenge Is Teaching AI to Play D&D. Some artificial intelligence experts think role playing adventure games will help machines learn to be as clever as we are.,/r/Futurology,"Friday, February 28, 2020 at 3:58:51 PM PST",13746,459
Using artificial intelligence to reanimate one of the fathers of artificial intelligence,/r/gifs,"Sunday, January 23, 2022 at 7:39:28 PM PST",13373,479
Synopsis for 04-12-2021 what we need to know before the market opens DD,/r/Superstonk,"Monday, April 12, 2021 at 2:31:50 AM PDT",13355,1000
An artificial intelligence has debated with humans about the the dangers of AI – narrowly convincing audience members that AI will do more good than harm.,/r/Futurology,"Sunday, November 24, 2019 at 1:38:28 PM PST",13287,796
"Riot's Deep Learning AI, dAImondbot 5.0, deletes itself after one game of diamond solo queue",/r/leagueoflegends,"Tuesday, December 26, 2017 at 11:16:28 AM PST",13258,594
"How Much Text is in Animal Crossing, and Why You Should Care",/r/NintendoSwitch,"Monday, June 24, 2019 at 12:20:58 PM PDT",13156,399
GPT-4 Week 3. Chatbots are yesterdays news. AI Agents are the future. The beginning of the proto-agi era is here,/r/ChatGPT,"Thursday, April 6, 2023 at 5:10:39 AM PDT",13125,2115
Anyone else feel annoyed that they're going to miss out on the future's inventions?,/r/NoStupidQuestions,"Thursday, May 7, 2020 at 5:23:16 PM PDT",13120,941
"Robots won't just take our jobs – they'll make the rich even richer: ""Robotics and artificial intelligence will continue to improve – but without political change such as a tax, the outcome will range from bad to apocalyptic""",/r/technology,"Thursday, March 2, 2017 at 3:33:05 AM PST",13078,2218
"In 1999, my mother took a $12/hour H-1B visa job so we could escape gun violence in South Africa. I'm now the CEO of a startup that uses AI to save lives during active shooter incidents. AMA!",/r/IAmA,"Tuesday, June 7, 2022 at 8:59:01 AM PDT",12798,1184
Artificial intelligence identifies previously unknown features associated with cancer recurrence,/r/technology,"Thursday, December 26, 2019 at 11:15:14 PM PST",12360,361
Artificial Intelligence,/r/ProgrammerHumor,"Saturday, December 23, 2017 at 2:10:41 AM PST",12275,253
Artificial intelligence researchers taught an AI to decide who a self-driving car should kill by feeding it millions of human survey responses,/r/Futurology,"Monday, October 16, 2017 at 8:58:25 AM PDT",12257,2334
aRtIfIcIaL iNtElLiGeNcE,/r/memes,"Wednesday, December 29, 2021 at 12:21:20 AM PST",12166,110
"Science AMA Series: We are evolution researchers at Harvard University, working on a broad range of topics, like the origin of life, viruses, social insects, cancer, and cooperation. Today is Charles Darwin’s birthday, and we’re here to talk about evolution. AMA!",/r/science,"Sunday, February 12, 2017 at 5:05:39 AM PST",12022,2254
"A painting entitled ""Abandoned Civilization"" is 9 paintings created and assembled by artificial intelligence AI to resemble the Mona Lisa.",/r/Damnthatsinteresting,"Monday, March 14, 2022 at 7:17:20 AM PDT",12012,119
Rwanda becomes first African country to launch centre dedicated to artificial intelligence | News24,/r/Futurology,"Monday, April 11, 2022 at 5:11:16 AM PDT",11956,390
"You're right, Reddit. He Gets Us does have an agenda. It's probably not what you think.",/u/hegetsus,"Wednesday, March 1, 2023 at 6:40:39 AM PST",11947,0
"You want to escalate to tier 3 support? Okay, there's a process for that, let's do it.",/r/MaliciousCompliance,"Thursday, June 16, 2022 at 10:54:02 PM PDT",11894,571
We are PhD students from Harvard University here to answer questions about artificial intelligence and cognition. Ask us anything!,/r/IAmA,"Saturday, July 29, 2017 at 9:31:56 AM PDT",11795,1388
"Saudi Arabia recently announced plans for a $500 billion techutopia mega-city Neom, with 100% solar energy, fully autonomous transportation, hydroponic farms, artificial intelligence, and advanced manufacturing, open to all races and religions - a “new civilization.”",/r/Futurology,"Sunday, December 24, 2017 at 3:00:25 AM PST",11782,930
"Governments have to invest in the fourth industrial revolution - ""artificial intelligence, nanotechnology, biotechnology, materials science, 3D printing and quantum computing to transform the global economy.""",/r/Futurology,"Sunday, July 16, 2017 at 6:57:03 AM PDT",11645,703
Having a Nephew when your name is Ben..,/r/marvelmemes,"Thursday, January 26, 2023 at 2:57:31 AM PST",11630,178
"Artificial intelligence system could help counter the spread of disinformation. Built at MIT Lincoln Laboratory, the RIO program automatically detects and analyzes social media accounts that spread disinformation across a network",/r/Futurology,"Thursday, May 27, 2021 at 5:08:26 PM PDT",11405,863
What,/r/LinkedInLunatics,"Saturday, May 27, 2023 at 9:14:20 AM PDT",11390,408
"Riot's ""Sandbox Mode"" reply makes it obvious how little they seem to understand the competitive setting of their game.",/r/leagueoflegends,"Wednesday, August 5, 2015 at 3:54:16 PM PDT",11327,2850
Stephen Hawking warns artificial intelligence could end mankind.,/r/technology,"Tuesday, December 2, 2014 at 5:23:42 AM PST",11321,3403
"Artificial Intelligence doesn't need to attack us Terminator style. It only needs to divide us further and we will do the dirty work for it, clearly.",/r/Showerthoughts,"Monday, March 29, 2021 at 4:31:39 PM PDT",11242,299
"Artificial intelligence will wipe out half the banking jobs in a decade, experts say",/r/technology,"Friday, April 20, 2018 at 2:54:20 PM PDT",11237,1208
"Jack Ma: We need to stop training our kids for manufacturing jobs - ""because of the artificial intelligence, because of the robots -- manufacturing is no longer the main engine of creating jobs""",/r/Futurology,"Wednesday, September 20, 2017 at 9:49:33 PM PDT",11068,888
Really putting the ‘A’ into “AI”,/r/facepalm,"Saturday, October 14, 2023 at 5:43:14 PM PDT",10949,286
"German ad: ""Artificial intelligence: the 4 most used drinks will be placed on the main screen""",/r/ProgrammerHumor,"Monday, September 19, 2022 at 3:49:57 AM PDT",10757,517
"I’m Eugene Kaspersky, cybersecurity guy and CEO of Kaspersky Lab! Ask me Anything!",/r/IAmA,"Thursday, May 11, 2017 at 5:30:31 AM PDT",10701,2515
"I don't like the relationship between my husband and his ""work wife"", and neither does her partner.",/r/BestofRedditorUpdates,"Thursday, November 3, 2022 at 12:11:31 PM PDT",10483,755
"I have trained an Artificial Intelligence (deep learning) model to detect brain tumor type through mobile camera, the original thing here I implement it to detect tumor in real-time through Snapchat filter.",/r/nextfuckinglevel,"Saturday, July 2, 2022 at 3:57:52 AM PDT",10364,296
"Sony patents a new system of backward compatibility of PS5 with PS4, PS3, PS2 and PSX",/r/Games,"Friday, February 1, 2019 at 4:25:59 AM PST",10353,1111
Facebook data privacy scandal has one silver lining: Thousands of new jobs AI can't handle - The Facebook data privacy and Russian election interference scandals show that artificial intelligence is still not up to many critical jobs in the technology sector.,/r/Futurology,"Saturday, March 24, 2018 at 3:08:57 AM PDT",10320,304
DeepMind just published a mind blowing paper - PathNet - potentially describing how general artificial intelligence will look like.,/r/Futurology,"Thursday, March 9, 2017 at 3:28:06 AM PST",9955,1235
(Repost cuz Reddit is evil) A warning for anyone working at or thinking about working at JPMorgan Chase & Co.,/r/antiwork,"Monday, May 15, 2023 at 9:15:14 PM PDT",9768,424
I cloned KSI's voice using Artificial Intelligence and made him sus,/r/ksi,"Thursday, June 1, 2023 at 11:43:53 PM PDT",9707,335
Artificial Intelligence and Robotics Uncover Hidden Signatures of Parkinson’s Disease,/r/Futurology,"Sunday, March 27, 2022 at 11:43:50 AM PDT",9589,109
An Artificial Intelligence Developed Its Own Non-Human Language,/r/Futurology,"Thursday, June 15, 2017 at 6:43:35 PM PDT",9578,758
"Alan Turing - ""The father Artificial Intelligence""",/r/ColorizedHistory,"Thursday, December 5, 2019 at 9:45:55 PM PST",9568,280
"Science AMA Series: I'm Joanna Bryson, a Professor in Artificial (and Natural) Intelligence. I am being consulted by several governments on AI ethics, particularly on the obligations of AI developers towards AI and society. I'd love to talk – AMA!",/r/science,"Friday, January 13, 2017 at 4:39:55 AM PST",9567,1767
"My latest project in artificial intelligence, detect skin cancer through camera, it was my submission for SnapML hackathon yesterday",/r/nextfuckinglevel,"Wednesday, August 31, 2022 at 12:16:43 PM PDT",9529,261
Why Humans Avoid War IV,/r/HFY,"Friday, March 12, 2021 at 2:26:46 PM PST",9512,211
"Girls with autism differ in several brain centers compared with boys with the disorder, suggesting gender-specific diagnostics are needed, a Stanford study using artificial intelligence found.",/r/science,"Thursday, February 17, 2022 at 12:42:34 PM PST",9459,689
Brain activity decoder can reveal stories in people’s minds. Artificial intelligence system can translate a person’s brain activity into a continuous stream of text.,/r/science,"Monday, May 1, 2023 at 8:51:17 AM PDT",9449,783
"In the movie Terminator 2, the Terminator and the T-1000 talking on the phone were two AI machines trying to convince each other that they were human.",/r/Showerthoughts,"Monday, December 28, 2015 at 5:04:56 AM PST",9413,588
